Pàėmė màno pir̃štines ir̃ lýg skrãdžiai žẽmę prasmẽgo.	Paėmė mano pirštines ir lyg skradžiai žemę prasmego.	He took my mittens and vanished into thin air.
Reĩkia málkų pririnktì, õ jõs apledė́ję.	Reikia malkų pririnkti, o jos apledėję.	I have to sort out firewood, and the logs are ice-cold.
Õ čià vélnias ė̃mė ir̃ sukìršino mùs.	O čia velnias ėmė ir sukiršino mus.	And to make it worse, the devil has brought about this enmity between us.
Tàvo širdimì... džiaugiúosi dė̃l tavę̃s, netìkėli.	Tavo širdimi... džiaugiuosi dėl tavęs, netikėli.	With your heart... I'm happy for you, you silly man.
Eĩk į̃ Mãskvą, tapýk ir̃ àš didžiúosiuos tavim̃.	Eik į Maskvą, tapyk ir aš didžiuosiuos tavim.	Go to Moscow, paint, and I'll be proud of you.
Õ tù, Diẽvo vérge, kíek atìdavei ùž tarnỹstę?	O tu, Dievo verge, kiek atidavei už tarnystę?	You, God's servant, how much did you pay to be ordained?
Ùž porà užliejamų̃ píevų ámžiną paláimą norė́jai nusipir̃kt.	Už pora užliejamų pievų amžiną palaimą norėjai nusipirkt.	For two or, luckily, for one water meadow, you wanted to win eternal bliss for yourself.
Nèdavė Diẽvas tãlento. Šlovė̃ táu, Viẽšpatie.	Nedavė Dievas talento. Šlovė tau, Viešpatie.	But God didn't give me talent, and thank God!
Vãkar atėjaĩ, sutanà lim̃pa, susiklijãvusi visà.	Vakar atėjai, sutana limpa, susiklijavusi visa.	The other night you came back with your cassock all glued together.
Pridė́k ką̃ nórs, õ taĩ užtìnsi kaĩp kuilỹs.	Pridėk ką nors, o tai užtinsi kaip kuilys.	Apply some damp dirt to it, or you'll be bloated like a hog.
Nesuprantù, kodė̃l àš tavè į̃ mókinius pasìėmiau.	Nesuprantu, kodėl aš tave į mokinius pasiėmiau.	I can't understand why I took you to be my assistant.
Kaĩ pilvè skam̃ba, apiẽ ką̃ galvóji?	Kai pilve skamba, apie ką galvoji?	Can you think of anything else when your belly growls?
Maldojè síela gãli nukeliáuti tìk nuõ mãtomo priẽ nemãtomo.	Maldoje siela gali nukeliauti tik nuo matomo prie nematomo.	Only through a prayer our soul can discern what's invisible.
Kur̃ taĩ matýta, kàd kiekvíenas drebė́tų dė̃l sàvo pastùrgalio?	Kur tai matyta, kad kiekvienas drebėtų dėl savo pasturgalio?	Where did you see all this, when everybody only think of saving their asses?
Jóms geriaũ nupliktì, negù tókias kančiàs kentė́ti.	Joms geriau nuplikti, negu tokias kančias kentėti.	They preferred to go bald rather than be tortured.
Taĩ pasakýk mán tiẽsiai – tam̃si liáudis, ar̃ nè?	Tai pasakyk man tiesiai – tamsi liaudis, ar ne?	All right, tell me in all honesty, are our people ignorant or not?
Õ tù ką̃, dė̃l sàvo tamsùmo, mãnai, núodėmių netùri?	O tu ką, dėl savo tamsumo, manai, nuodėmių neturi?	Have you never sinned because you're ignorant?
Prisimiñsi màno žodžiùs, tadà taĩ prasidė̃s...	Prisiminsi mano žodžius, tada tai prasidės...	Mind my word, it will be hell!
Kaĩp sù tokiomìs mintimìs gãli tapýti? Nesuprantù.	Kaip su tokiomis mintimis gali tapyti? Nesuprantu.	I don't understand how you can paint, having thoughts like that.
Àš seniaĩ bū́čiau atsižadė́jęs ir̃ olojè per̃ ámžių gyvénčiau.	Aš seniai būčiau atsižadėjęs ir oloje per amžių gyvenčiau.	I'd have taken vows of schema long ago and settled down in a cave for good.
Àš tarnáuju Diẽvui, õ nè žmonė́ms.	Aš tarnauju Dievui, o ne žmonėms.	I serve God, not people.
Vìskas tamè ratè... ir̃ sùkasi, ir̃ sùkasi...	Viskas tame rate... ir sukasi, ir sukasi...	Everything falls back into place again, and goes round and round...
Mãnai, kàd gė̃rį vienám gãlima kurtì?	Manai, kad gėrį vienam galima kurti?	You think that good can be done only single-handedly?
Jė́zus taĩp pàt riñko žmónes šventóvėse ir̃ mókė juõs.	Jėzus taip pat rinko žmones šventovėse ir mokė juos.	Jesus gathered people in the temples, too. He taught them.
Jùdas par̃davė Krìstų, õ, prisimiñk, kàs nupir̃ko?	Judas pardavė Kristų, o, prisimink, kas nupirko?	Judas had sold Christ out. But do you remember who bought Him?
Liùdininko, kíek besisténgė, taĩp ir̃ nerãdo.	Liudininko, kiek besistengė, taip ir nerado.	They couldn't find any witness, however hard they might have tried.
Õ fariziẽjai apgavỹsčių meistraĩ. Išsilãvinę, gùdrūs.	O fariziejai apgavysčių meistrai. Išsilavinę, gudrūs.	And the Pharisees were great deceivers, literate and cunning.
Õ añt mužìko vìs naũjos bė̃dos pìlasi.	O ant mužiko vis naujos bėdos pilasi.	And the Russian man gets more and more misfortunes.
Õ jìs vìs dìrba, kañtriai nẽša sàvo krỹžių.	O jis vis dirba, kantriai neša savo kryžių.	But he keeps working and working, bearing his cross with humility.
Tìk mel̃džia Diẽvą, kàd jėgų̃ užtèktų...	Tik meldžia Dievą, kad jėgų užtektų...	And only praying to God to give him enough strength to endure.
Ar̃gi tokíems Aukščiáusias neatleĩs jų̃ tamsùmo?	Argi tokiems Aukščiausias neatleis jų tamsumo?	Can the Almighty not forgive such men their ignorance?
Jéi Jė́zus – nuõ Diẽvo, réiškia – Visagãlis.	Jei Jėzus – nuo Dievo, reiškia – Visagalis.	Jesus comes from God, it means He's Almighty.
Jéi mìrė añt krỹžiaus, réiškia taĩp lémta bùvo?	Jei mirė ant kryžiaus, reiškia taip lemta buvo?	And His dying on the cross must have been preordained.
Keliáusi į̃ Sìbirą ikònų atnaũjinti ùž tókias kalbàs.	Keliausi į Sibirą ikonų atnaujinti už tokias kalbas.	For these words, you'll be packed off to the North to fix up icons.
Vìską tíems Diẽvo tarnáms žinóti reĩkia...	Viską tiems Dievo tarnams žinoti reikia...	You, God's servants, need to know everything.
Tìk akmenė̃lį pakabìnsim, kàd bū́tų lengviaũ į̃ viẽtą nuplauktì.	Tik akmenėlį pakabinsim, kad būtų lengviau į vietą nuplaukti.	With a stone on your neck, for you to swim faster to your destination.
Krìs ugnìs ìš dangaũs – visùs jùs sudẽgins.	Kris ugnis iš dangaus – visus jus sudegins.	A fire will fall down from heavens and will scorch you all!
Mẽs tavè dabar̃ priẽ šìtos kryžmė̃s prirìšim.	Mes tave dabar prie šitos kryžmės pririšim.	We'll fix you right to this crosspiece.
Beñt jaũ kójom į̃ vir̃šų rìškite.	Bent jau kojom į viršų riškite.	At least tie me with my feet up.
Núodėmė nuogíems bėgióti ir̃ krėstì visókius...	Nuodėmė nuogiems bėgioti ir krėsti visokius...	Because it's a sin to run about naked and do things like that.
Šiañdien tokià naktìs – visì mylė́ti tùri.	Šiandien tokia naktis – visi mylėti turi.	This is the night when everyone should love.
Jėgà į̃ sàvo tikė́jimą atverstì norė́site.	Jėga į savo tikėjimą atversti norėsite.	To convert us to your faith by force.
Mãnai leñgva và taĩp, báimėje gyvénti?	Manai lengva va taip, baimėje gyventi?	You think it's easy to live in fear, like we do?
Jų̃ dienẽlė nuõ pàt rýto rìtasi kaĩp į̃prasta.	Jų dienelė nuo pat ryto ritasi kaip įprasta.	Each day for them rolls by itself.
Tę̃siasi nuõ rýto ikì vãkaro. Ir̃ gãlo nematýt.	Tęsiasi nuo ryto iki vakaro. Ir galo nematyt.	it drags on and on from morn till night, with no end.
Nè Sergèjus, õ àš pìrmas pasakiaũ, kàd káršta.	Ne Sergejus, o aš pirmas pasakiau, kad karšta.	It's I who said first it's hot, not Sergey.
Và ir̃ pasiuntinỹs nušuoliãvo skų́stis kunigáikščiui.	Va ir pasiuntinys nušuoliavo skųstis kunigaikščiui.	You see, a messenger already went to complain to the Prince.
Pàts Didỹsis kunigáikštis pasãkė, kàd geraĩ.	Pats Didysis kunigaikštis pasakė, kad gerai.	The Grand Prince himself had approved it.
Kõ mẽs giñčijamės dù mė́nesius ikì užkimìmo?	Ko mes ginčijamės du mėnesius iki užkimimo?	What have we been shouting ourselves hoarse about for two months?
Õ kaĩp àš žmonė́ms į̃ akìs pažiūrė́siu?	O kaip aš žmonėms į akis pažiūrėsiu?	And how am I going to look people in the eyes?
Àš tókį vélnią sugalvójau. Ìš nósies dū́mai, õ ãkys...	Aš tokį velnią sugalvojau. Iš nosies dūmai, o akys...	I know how to paint the devil, with smoke from his nose and eyes like...
Kõ sukì akìs šónan? – Negaliù àš...	Ko suki akis šonan? – Negaliu aš...	- Why won't you look me in the eye?
Méilė ilgaĩ keñčia ir̃ ỹra gailestìnga.	Meilė ilgai kenčia ir yra gailestinga.	Love suffers long, and is kind;
Nórs ir̃ baĩgsis pranašỹstės, nutil̃s kal̃bos, paseñs žìnios.	Nors ir baigsis pranašystės, nutils kalbos, pasens žinios.	But whether there be prophesies, they shall fail; whether there be tongues, they'll cease; ...knowledge, it shall vanish away.
Paléisk, õ taĩ į̃ arklìdę išsių̃siu.	Paleisk, o tai į arklidę išsiųsiu.	Let go, or I'll send you to the stable!
Nebijók, táu rū́mų ùž mùs geriaũ niẽkas nepastatỹs.	Nebijok, tau rūmų už mus geriau niekas nepastatys.	Don't worry, no one could've built you a mansion like we have.
Svarbù nè išmãnymas, õ tuõ išmãnymu kunigáikštį išgar̃sinti.	Svarbu ne išmanymas, o tuo išmanymu kunigaikštį išgarsinti.	What matters is not your skill, but to be able to glorify the prince.
Kaĩ broliùkas per̃ Velýkas bùvo atvažiãvęs... Tadà ir̃ sùtarėm.	Kai broliukas per Velykas buvo atvažiavęs... Tada ir sutarėm.	We agreed on it when your brother was here at Easter time.
Pažiūrė́jau į̃ kunigáikštį, õ jìs vìsas àpmirė.	Pažiūrėjau į kunigaikštį, o jis visas apmirė.	I looked at the prince, he just stood still.
Vìs bìjo, kàd broliùkas pérspjaus jį̃.	Vis bijo, kad broliukas perspjaus jį.	He's afraid that his brother will go one up on him.
Výras besimel̃džiantis ùždengta galvà užsitráukia gė́dą.	Vyras besimeldžiantis uždengta galva užsitraukia gėdą.	Every man praying or prophesying, having his head covered, dishonoreth his head.
Nès jéi žmonà nenóri prisideñgti, tadà tegul̃ ker̃pasi.	Nes jei žmona nenori prisidengti, tada tegul kerpasi.	For if the woman be not covered, let her also be shorn.
Õ jéi jái gė́da kir̃ptis, tadà tegù prisideñgia.	O jei jai gėda kirptis, tada tegu prisidengia.	But if it be a shame for a woman to be shorn or shaven, let her be covered.
Nè výras sukùrtas žmónai, õ žmonà výrui.	Ne vyras sukurtas žmonai, o žmona vyrui.	Neither was the man created for the woman, but the woman for the man.
Todė̃l žmonà añt galvõs tùri turė́ti angelų̃ valdžiõs žénklą.	Todėl žmona ant galvos turi turėti angelų valdžios ženklą.	For this cause ought the woman to have power on her head, because of the angels.
Pasvarstýkit, ar̃ geraĩ žmónai mel̃stis Diẽvui, neprìdengta galvà?	Pasvarstykit, ar gerai žmonai melstis Dievui, nepridengta galva?	Is it proper for a woman praying to God uncovered?
Bèt žmónai augìnti palukùs – garbė̃, nès plaukaĩ duotì...	Bet žmonai auginti palukus – garbė, nes plaukai duoti...	But if a woman has long hair, it is a glory to her; for her hair is given her...
Jái taĩ garbė̃...nès plaukaĩ jái duotì viẽtoj...	Jai tai garbė...nes plaukai jai duoti vietoj...	...it is a glory to her. For her hair is given her for...
Kokià jì nusidė́jėlė, nórs ir̃ nenešiója skarẽlės?	Kokia ji nusidėjėlė, nors ir nenešioja skarelės?	How can she be a sinner, even if she doesn't wear a kerchief?
Paklausýk, kunigáikšti, kokià bóba čià gùli?	Paklausyk, kunigaikšti, kokia boba čia guli?	Listen, Prince, who is that woman lying down?
Kokià gì jì mergẽlė, jéi tùri sū́nų.	Kokia gi ji mergelė, jei turi sūnų.	How can she be a virgin if she has a son?
Nórs pàs jùs Rùsijoje vìsko gãli būtì.	Nors pas jus Rusijoje visko gali būti.	Well though, in this Russia of yours, even stranger things happen.
Pažiūrė́k, kaĩp rùsą, stačiãtikį, nekal̃tą žmógų vãgys kankìna.	Pažiūrėk, kaip rusą, stačiatikį, nekaltą žmogų vagys kankina.	Look how a Russian, Orthodox, innocent man is being tortured by thieves.
Paminė́si màno žõdį – kójos totõrių nebùs rùsų žẽmėje.	Paminėsi mano žodį – kojos totorių nebus rusų žemėje.	Mind my words, never there will be the Tartar's foot on Russian soil.
Jéi tùrime núodėmių, mùms Viẽšpats atleĩs.	Jei turime nuodėmių, mums Viešpats atleis.	If I've sinned, the Lord will forgive me.
Õ tù žiū̃ri ir̃ pirštù į̃ lángą béldi.	O tu žiūri ir pirštu į langą beldi.	You were looking and knocking on the window with your finger.
Žùdo, prievartáuja, kartù sù totõriais bažnýčias plė́šia.	Žudo, prievartauja, kartu su totoriais bažnyčias plėšia.	They murder, they rape, they plunder churches together with the Tartars.
Õ manè žinaĩ, kíek karų̃ dẽgino?	O mane žinai, kiek karų degino?	Do you know how much of my work has been burned?
Ùž mū́sų núodėmes blõgis įgãvo žmõgišką pavìdalą.	Už mūsų nuodėmes blogis įgavo žmogišką pavidalą.	It's because of our sins that evil has taken a human guise.
Kėsiníesi į̃ blõgį – kėsiníesi į̃ žmogaũs kū́ną.	Kėsiniesi į blogį – kėsiniesi į žmogaus kūną.	Attempting to kill evil, you make an attempt on human life.
Diẽvas atleĩs. tìk tù sáu neatléisk.	Dievas atleis. tik tu sau neatleisk.	God will forgive you, but you must not forgive yourself.
Taĩp ir̃ gyvénk, tar̃p atleidìmo ir̃ sàvo graužatiẽs.	Taip ir gyvenk, tarp atleidimo ir savo graužaties.	And go on living between His forgiveness and your own torment.
Tadà ateĩkite ir̃ atsiteĩsim, pasãkė Viẽšpats.	Tada ateikite ir atsiteisim, pasakė Viešpats.	Come now, and let us reason together, Says the Lord,
Neturiù apiẽ ką̃ sù žmonėmìs šnekė́tis.	Neturiu apie ką su žmonėmis šnekėtis.	I have nothing to talk with people about any more.
Õ ar̃gi tù nè į̃ rõjų patekaĩ?	O argi tu ne į rojų patekai?	Haven't you got in Paradise?
Niẽko nėrà baisiaũ, kadà cer̃kvėje sniñga.	Nieko nėra baisiau, kada cerkvėje sninga.	There's nothing more frightful than snow falling in the temple. Don't you think so?
Tuščiàs káimas. Rytè prõ šãlį ėjaũ.	Tuščias kaimas. Ryte pro šalį ėjau.	There's no one in Semyonovka, I passed by it this morning.
Õ kàs lìko – žiùrkes gáudo.	O kas liko – žiurkes gaudo.	Those that stayed are hunting rats.
Vilkaĩ apsùpo, taĩ àš nuõ jų̃ į̃ ẽžerą.	Vilkai apsupo, tai aš nuo jų į ežerą.	The wolves got the better of me, so I waded into the lake.
Stoviù ir̃ Diẽvo prašaũ, kàd nešóktų.	Stoviu ir Dievo prašau, kad nešoktų.	I only prayed to God that they wouldn't jump in.
Štaĩ dár víenas ìš Vladìmiro eĩna.	Štai dar vienas iš Vladimiro eina.	There comes another man from Vladimir.
Ką̃ totõriai ùžmušė, õ kàs išsibar̃stė į̃ visàs šalìs.	Ką totoriai užmušė, o kas išsibarstė į visas šalis.	Some were killed by Tartars, others went their own ways. And Danila?
Lýg į̃ šiáurę patráukė, lýg nùmirė...	Lyg į šiaurę patraukė, lyg numirė...	Either he went to the North, or he's dead.
Turiù septýnias žmónas, tìk rùsės neturiù.	Turiu septynias žmonas, tik rusės neturiu.	I got seven wives, but no Russian wife yet.
Opà visùs pasìėmė: ir̃ mãmą, ir̃ sẽserį.	Opa visus pasiėmė: ir mamą, ir seserį.	The plague has gotten them all: My mother, sister and father, too.
Õ taĩ jìs gùli, kriùksi ir̃ akių̃ neatmer̃kia.	O tai jis guli, kriuksi ir akių neatmerkia.	He's lying in bed, whizzing, with his eyes closed.
Nė̃ víenas žmogùs daugiaũ tõ nežìno, tìk àš.	Nė vienas žmogus daugiau to nežino, tik aš.	No one else knows it!
Õ tù nóri, kàd Didỹsis mùms septýnis káilius nudìrtų?	O tu nori, kad Didysis mums septynis kailius nudirtų?	Do you want the Grand to skin us alive?
Õ žinaĩ, ką̃ tė́vas priẽš mir̃tį pasãkė?	O žinai, ką tėvas prieš mirtį pasakė?	You know what my father said before he died?
Klausýk, Stepãnai, õ gál bè reĩkalo mẽs...?	Klausyk, Stepanai, o gal be reikalo mes...?	Listen, Stepan, maybe we shouldn't do it?
Rugpjū́tis baĩgiasi, õ mẽs dár mólio nerãdom.	Rugpjūtis baigiasi, o mes dar molio neradom.	August is almost over, and we haven't found the clay!
Štaĩ kíek mẽtų bè tàvo gaĩlesčio pragyvenaũ.	Štai kiek metų be tavo gailesčio pragyvenau.	I've lived without your pity for years!
Negaliù. Tikraĩ žinaũ, kàd nè tóks mólis.	Negaliu. Tikrai žinau, kad ne toks molis.	I know that's not the right clay!
Sãko dár per̃ pigù ùž tókią vir̃vę.	Sako dar per pigu už tokią virvę.	They say they give this rope cheap.
Nà, kàs? Fòrma neišlaikỹs. Reikì dár apipintì.	Na, kas? Forma neišlaikys. Reiki dar apipinti.	This mould won't hold, we'll have to twine it all around.
Laĩkas móliu apteptì,õ jū̃s dár karkãso nepadãrėt.	Laikas moliu aptepti,o jūs dar karkaso nepadarėt.	It's time to coat it with clay, and you haven't made the mould yet!
Reĩkia dár tvìrtinti, õ strỹpai baĩgėsi.	Reikia dar tvirtinti, o strypai baigėsi.	We need to reinforce it more, but there're no more twigs.
Jéi fòrmos nesutvìrtinsim, neišlaikỹs jì vãrio ir̃ skil̃s.	Jei formos nesutvirtinsim, neišlaikys ji vario ir skils.	If the mould isn't reinforced, it won't stand bronze, it'll crack.
Õ jéi ikì sniẽgo nespė́sim išdegtì?	O jei iki sniego nespėsim išdegti?	What if we don't bake it before snow?
Tàvo tė́vas sù mumìs taĩp nesìelgė.	Tavo tėvas su mumis taip nesielgė.	Your father didn't treat us like that.
Niẽko nežinaũ. Reĩkia dár pùsės pū́do.	Nieko nežinau. Reikia dar pusės pūdo.	I don't know, but we need another half pood.
Kàs žìno var̃po vãrio pãslaptį? Tù ar̃ àš?	Kas žino varpo vario paslaptį? Tu ar aš?	Who knows the secret of bell bronze, you or me?
daũg sidãbro iškratýsiu dabar̃ ìš kunigáikščio.	daug sidabro iškratysiu dabar iš kunigaikščio.	I'm going to shake a lot of silver out of the prince.
Niẽko jìs nepar̃davė, nekaltàs jìs štaĩ jùms šventàs krỹžius.	Nieko jis nepardavė, nekaltas jis štai jums šventas kryžius.	He's innocent, he never betrayed anyone! I can swear on the cross!
Taĩp gráužė pavỹdas, lýg nuodaĩs prisipìldžiau.	Taip graužė pavydas, lyg nuodais prisipildžiau.	Envy was eating me up so much that it had poisoned my guts.
Kàd tìk Šveñtą rãštą suspė́čiau ikì mirtiẽs pérrašyti...	Kad tik Šventą raštą suspėčiau iki mirties perrašyti...	I just want to finish copying the Scriptures before I die.
Ùž kókius šventùs dárbus gavaĩ ìš Diẽvo tãlentą?	Už kokius šventus darbus gavai iš Dievo talentą?	For what holy deeds has God given you your talent?
Õ dabar̃ gyvẽnimas baĩgiasi, õ síela prãšo ramýbės.	O dabar gyvenimas baigiasi, o siela prašo ramybės.	But now that my life's coming to an end, my soul cries for eternal rest.
Todė̃l ir̃ kviẽčia. Kàd tàvo tãlentu sàvo val̃džią išgar̃sintų.	Todėl ir kviečia. Kad tavo talentu savo valdžią išgarsintų.	He's calling you, because he wants to strengthen and glorify his power with your talent.
Eĩk į̃ Trejýbę ir̃ tapýk, tapýk.	Eik į Trejybę ir tapyk, tapyk.	Go to the Trinity and paint, paint!
Baisì núodėmė nepaisytì Diẽvo dúotos kibirkštiẽs.	Baisi nuodėmė nepaisyti Dievo duotos kibirkšties.	It's a great sin, to reject a God-given gift.
Pažiūrė́k į̃ manè. Pažiūrė́k į̃ menkỹstą.	Pažiūrėk į mane. Pažiūrėk į menkystą.	Look at me, look at the one who has no talent!
Dė̃l dúonos ką́snio, kàd ramiaĩ nugyvénčiau.	Dėl duonos kąsnio, kad ramiai nugyvenčiau.	Just to have something to eat and to live out my days in peace.
Greĩt mir̃siu ir̃ niẽko nelìks põ manę̃s.	Greit mirsiu ir nieko neliks po manęs.	I'm going to die soon, and nothing will be left after me.
Tù nóri į̃ kãpą sàvo tãlentą nusinèšti?	Tu nori į kapą savo talentą nusinešti?	Do you want to take your talent with you into your grave?
Čià gãli nutrūktì. – Kàd táu liežùvis nudžiū́tų.	Čia gali nutrūkti. – Kad tau liežuvis nudžiūtų.	- It may break in this place.
Nè mazgaĩs rìšt reikė́jo, õ geležimì tvìrtinti.	Ne mazgais rišt reikėjo, o geležimi tvirtinti.	We shouldn't have tied it in a knot, it should've been fastened with metal.
Tfù... kunigáikštis sù ùžsienio pãsiuntiniu važiúoja.	Tfu... kunigaikštis su užsienio pasiuntiniu važiuoja.	Damn it, the Grand Prince is coming, and a foreign ambassador with him.
Tė́vas, senàs žvėrìs, taĩp ir̃ nepérdavė paslaptiẽs.	Tėvas, senas žvėris, taip ir neperdavė paslapties.	My father, the old beast, would not pass to me the secret.
Kokià šveñtė žmonė́ms. Tókį džiaũgsmą sutvė́rė, õ dár ver̃kia.	Kokia šventė žmonėms. Tokį džiaugsmą sutvėrė, o dar verkia.	You've created such a feast, such a joy for people.
Põnas Mìleris ìš Apsaugõs Stotiẽs turė́jo manè pasitìkti.	Ponas Mileris iš Apsaugos Stoties turėjo mane pasitikti.	Mr. Miller of Station Security is supposed to meet me.
Kaĩ užsidègs raudóna lempùtė, tę̃skite, štaĩ tokià tvarkà:	Kai užsidegs raudona lemputė, tęskite, štai tokia tvarka:	When you see the red light go on, please state in the following order:
-Ar̃ àš dár turiù laĩko pùsryčiams?	-Ar aš dar turiu laiko pusryčiams?	-Have I got time for breakfast?
Àš jùms rezervavaũ staliùką Žẽmės Šviesõs Kambaryjè.	Aš jums rezervavau staliuką Žemės Šviesos Kambaryje.	I've reserved a table for you in the Earthlight Room.
Spė́ju jùs jaũ mẽtėte naũją skỹriaus dárbą?	Spėju jus jau metėte naują skyriaus darbą?	I suppose you saw the work on the new section?
Ar̃ tù rytój atvỹksi į̃ màno vakarė̃lį?	Ar tu rytoj atvyksi į mano vakarėlį?	Are you coming to my party tomorrow?
Àš táu atsių̃siu labaĩ grãžią dóvaną.	Aš tau atsiųsiu labai gražią dovaną.	I'm going to send you a very nice present, though.
Gál nóri kõ nórs kìto sàvo gimtãdieniui?	Gal nori ko nors kito savo gimtadieniui?	Can't you think of anything else for your birthday?
Nóriu kàd kaĩ ką̃ pérduotum mamýtei nuõ manę̃s.	Noriu kad kai ką perduotum mamytei nuo manęs.	I want you to tell Mummy something for me.
Rū́pinkis savimì ir̃ bū́k gẽra mergáite, geraĩ?	Rūpinkis savimi ir būk gera mergaite, gerai?	Take care and be a good girl, won't you?
-Elenà, kaĩp malonù tavè vė̃l matýti.	-Elena, kaip malonu tave vėl matyti.	-Elena, how nice to see you again.
-Gál norė́tumėte kõ nórs išgertì, daktarè?	-Gal norėtumėte ko nors išgerti, daktare?	-Would you like a drink, Doctor?
-Kaĩ jì pamatýsite, pérduokit nuõ manę̃s linkė́jimus.	-Kai ji pamatysite, perduokit nuo manęs linkėjimus.	-When you see him, give him my regards. -Yes, of course.
Àš bijaũ, kàd gãli kiltì šióks tóks skandãlas.	Aš bijau, kad gali kilti šioks toks skandalas.	I'm afraid there's going to be a bit of a row about it.
Jū̃s kažkaĩp labaĩ vañgiai kal̃bate šià temà...	Jūs kažkaip labai vangiai kalbate šia tema...	At the risk of pressing you on a point you seem reticent to discuss...
Bèt epidèmija gãli lengvaĩ pérsikelti ir̃ į̃ mū́sų bãzę.	Bet epidemija gali lengvai persikelti ir į mūsų bazę.	But this epidemic could easily spread to our base.
Jéi vỹksite, pasiim̃kite sàvo nuostãbią dukrẽlę kartù.	Jei vyksite, pasiimkite savo nuostabią dukrelę kartu.	If you do, bring that darling little daughter with you.
Taĩ priklausỹs nuõ vãsaros atóstogų ir̃ kitų̃ dalỹkų.	Tai priklausys nuo vasaros atostogų ir kitų dalykų.	That'll depend on school vacations and all that sort of thing.
Àš jaũ baigiaũ. -Labaĩ ãčiū jùms põnai.	Aš jau baigiau. -Labai ačiū jums ponai.	-Thank you very much, gentlemen.
Priẽš pasitarìmą, jìs norė́tų pérsimesti sù jumìs keliaĩ žõdžiais.	Prieš pasitarimą, jis norėtų persimesti su jumis keliai žodžiais.	Before the briefing, he'd like to have a few words with you.
Ir̃, žìnoma, jõ svéikinimai dė̃l jū́sų atradìmo...	Ir, žinoma, jo sveikinimai dėl jūsų atradimo...	And, of course, his congratulations on your discovery...
Àš žinaũ, kàd bùvo daũg prieštarìngų núomonių...	Aš žinau, kad buvo daug prieštaringų nuomonių...	... Iknowtherehavebeen some conflicting views...
Tiksliaũ kal̃bant, dė̃l jū́sų nesutikìmo sù istòrija...	Tiksliau kalbant, dėl jūsų nesutikimo su istorija...	More specifically, your opposition to the cover story...
Àš suprantù, kàd taĩ prìncipo kláusimas...	Aš suprantu, kad tai principo klausimas...	I understand that beyond it being a matter of principle...
