Ar̃ nèskamba šìs var̃das kaĩp vidùrnakčio Mirtiẽs šaũksmas?	Ar neskamba šis vardas kaip vidurnakčio Mirties šauksmas?	Does not this name sound like the very midnight call of Death?
Vienà bùvo áišku: jìs sumokė́jo ùž sàvo žmónes.	Viena buvo aišku: jis sumokėjo už savo žmones.	One thing was sure: he paid his people well.
Àš išvykstù kẽletui mė́nesių į̃ šmė́klų ir̃ vaiduõklių šãlį.	Aš išvykstu keletui mėnesių į šmėklų ir vaiduoklių šalį.	I may be away for several month, dear Ellen, away in a country of ghosts and robbers.
Šiojè pilyjè miegójau gañ sunkeĩ, bèt nesijáudink...	Šioje pilyje miegojau gan sunkei, bet nesijaudink...	One's dreams are heavy in this deserted castle, but do not fear...
Sulìg príeblanda ir̃ grėsmìngais šešė́liais tùščia pilìs vė̃l atgìjo.	Sulig prieblanda ir grėsmingais šešėliais tuščia pilis vėl atgijo.	With twilight the empty castle came alive again with menacing shadows.
Šì móteris tùri labaĩ grãžų kãklą.	Ši moteris turi labai gražų kaklą.	Your wife has a beautiful neck.
Bèt àš žinaũ, kàd nãktį jõs síela girdė́jo šaũksmą.	Bet aš žinau, kad naktį jos siela girdėjo šauksmą.	But I know that in that night her soul had heard the call of death.
Plaũstas pasiródė įtar̃tinas dė̃l jų̃ plùkdomo kraupaũs króvinio.	Plaustas pasirodė įtartinas dėl jų plukdomo kraupaus krovinio.	The raftsmen little suspected what terrible cargo they carried down the valley.
Vãkar valstiẽčiai àtnešė jį̃ į̃ ligóninę.	Vakar valstiečiai atnešė jį į ligoninę.	The peasants brought him into the hospital yesterday.
Sãkė, kàd jìs nukrìto nuõ kálno.	Sakė, kad jis nukrito nuo kalno.	They said he fell from a mountain.
Šią̃ nãktį į̃ jū́rą tùri nueitì paláiminimas.	Šią naktį į jūrą turi nueiti palaiminimas.	The ship must set sail this night.
Profèsorius papãsakojo sàvo studeñtams apiẽ mė̃sėdžio áugalo egzistãvimą.	Profesorius papasakojo savo studentams apie mėsėdžio augalo egzistavimą.	At the same time, professor Bulwar explained to his pupils the cruelty of carnivorous plants.
Lýg kokià epidèmija, taĩ išplìto põ vìsą laĩvą.	Lyg kokia epidemija, tai išplito po visą laivą.	Like an epidemic it spread over the entire ship.
Sãko, kàd kajùtėje ỹra keistàs keleĩvis.	Sako, kad kajutėje yra keistas keleivis.	Mate has begun to hallicunate, says a strange passenger is below deck. Course: SE.
- Pãnika añt bòrto - Trỹs výrai mìršta	- Panika ant borto - Trys vyrai miršta	- Panic on board - Three men dead already - mate out of his mind
- Padėjė́jas išprotė́ja - Žiùrkės laĩvo triumè.	- Padėjėjas išprotėja - Žiurkės laivo triume.	- Rats in the hold - I fear the plague...
Kõl kàs jì negãli atsispìrti keistam̃ knỹgos žãvesiui.	Kol kas ji negali atsispirti keistam knygos žavesiui.	Yet she was unable to withstand its strange fascination.
Jìs stẽbi manè kiekvíeną vãkarą.	Jis stebi mane kiekvieną vakarą.	Look! Every night, in front of me.
Nà, põnai, pažiūrė́kime, kõ dár išmókote.	Na, ponai, pažiūrėkime, ko dar išmokote.	Well gentlemen, let's see what else you have learned.
Markàs Antònijus nebūtų̃ pasãkęs sàvo kalbõs?	Markas Antonijus nebūtų pasakęs savo kalbos?	Mark Anthony hadn't held his oration?
- Ìš kur̃ gavaĩ tàs núotraukas?	- Iš kur gavai tas nuotraukas?	- How did you get those photos?
Tikriáusiai kàs nórs jàs įkìšo į̃ màno pòrtfelį.	Tikriausiai kas nors jas įkišo į mano portfelį.	Somebody must have put them in my briefcase.
Bèt màno pianòlos Niẽkas negaũs paliestì	Bet mano pianolos Niekas negaus paliesti	But as formypianola No one gets to touch it
Jéi kàs nórs nóri mán kompãniją palaikýti	Jei kas nors nori man kompaniją palaikyti	Ifsomeone wants to accompany me
Põnai, šįvãkar àš ką̃ nórs išsiriñksiu	Ponai, šįvakar aš ką nors išsirinksiu	Guys, tonight I'm gonna pick someone
Põnai, šįvãkar àš ką̃ nórs išsiriñksiu	Ponai, šįvakar aš ką nors išsirinksiu	Guys, tonight I'm gonna pick someone
Výrą, tìkrą výrą Mán nusibódo jaunuõliai	Vyrą, tikrą vyrą Man nusibodo jaunuoliai	A man, a real man I'm fed up with the young ones
Trumpaĩ, výrą, kurìs dár nóri bučiúotis ir̃ taĩ sùgeba	Trumpai, vyrą, kuris dar nori bučiuotis ir tai sugeba	In short, a man who still wants To kiss and is good at it
Põnai, šįvãkar àš ką̃ nórs išsiriñksiu	Ponai, šįvakar aš ką nors išsirinksiu	Guys, tonight I'm gonna pick someone
Ką̃, põ gãlais, jū̃s dãrote màno miegamãjame?	Ką, po galais, jūs darote mano miegamajame?	What in the world are you doing in my bedroom?
Jū̃s vẽdat ìš kẽlio màno mókinius.	Jūs vedat iš kelio mano mokinius.	You are corrupting my students.
Mãnote, kàd àš laikaũ vaikų̃ daržẽlį?	Manote, kad aš laikau vaikų darželį?	Do you think I'm running a kindergarten?
Norė́čiau sužinóti, kur̃ màno skrybėlė̃... Mečiaũ gertì.	Norėčiau sužinoti, kur mano skrybėlė... Mečiau gerti.	I wish I knew where my hat... I've quit drinking.
Sù kókiu tipù tù čià dabar̃ šlaistaĩsi?	Su kokiu tipu tu čia dabar šlaistaisi?	What fruit are you hanging out with now?
Mán labaĩ malonù susipažìnti sù víena miẽsto iškilių̃ asmenýbių.	Man labai malonu susipažinti su viena miesto iškilių asmenybių.	I am delighted to meet one of the town's eminent personalities.
Profèsoriau, léiskite mán pagirtì jū́sų skõnį.	Profesoriau, leiskite man pagirti jūsų skonį.	Professor, let me commend you on your taste.
Àš atėjaũ, nès jū̃s vẽdate ìš kẽlio màno mókinius.	Aš atėjau, nes jūs vedate iš kelio mano mokinius.	I am here because you harbor my students.
Atstók nuõ manę̃s sù sàvo ángliškom nesą́monėm!	Atstok nuo manęs su savo angliškom nesąmonėm!	Leave me alone with that English nonsense!
Ir̃ tù atėjaĩ nė̃ trupùčio dė̃l manę̃s?	Ir tu atėjai nė trupučio dėl manęs?	And you didn't come because of me at all?
Šįvãkar jū̃s čià nè oficialiù reĩkalu, manýčiau.	Šįvakar jūs čia ne oficialiu reikalu, manyčiau.	Tonight you're not here in official capacity, I assume.
Bijaũ, kàd netiñkamai elgiaũsi pràeitą vãkarą.	Bijau, kad netinkamai elgiausi praeitą vakarą.	I'm afraid I didn't behave properly last night.
Jū́sų berniùkai turė́tų jùs tókį pamatýti.	Jūsų berniukai turėtų jus tokį pamatyti.	Your boys should see you like this.
Tiẽsą sãkant, jū̃s visái patrauklùs výras.	Tiesą sakant, jūs visai patrauklus vyras.	Actually, you're a pretty handsome man.
Tõ jūreĩvio pinigìnė plýšta per̃ siūlès.	To jūreivio piniginė plyšta per siūles.	That's sailor's wallet is bursting.
Kaĩp tù drįstì kabinė́tis priẽ šiõs dãmos?	Kaip tu drįsti kabinėtis prie šios damos?	How dare you molest this lady?
Atléiskite, Profèsoriau, bèt polìcija jaũ čià.	Atleiskite, Profesoriau, bet policija jau čia.	Excuse me, Professor, but the police are here.
Atstókit nuõ manę̃s sù tõm nesą́monėm.	Atstokit nuo manęs su tom nesąmonėm.	Leave me alone with that nonsense.
Šìs výras nóri pateiktì jùms káltinimus.	Šis vyras nori pateikti jums kaltinimus.	This man wants to press charges against you.
Manaũ, jū̃s suprañtate, kókias pãsekmes šìs į́vykis jùms turė̃s.	Manau, jūs suprantate, kokias pasekmes šis įvykis jums turės.	I assume you realize the consequences of this incident for you.
Dė̃l Diẽvo méilės, kàs atsitìko, Profèsoriau?	Dėl Dievo meilės, kas atsitiko, Profesoriau?	For God's sake, what's wrong, Professor?
Dúosiu jùms ypatìngų váistų ìš sàvo asmenìnės váistinės.	Duosiu jums ypatingų vaistų iš savo asmeninės vaistinės.	I'll get you some special medicine from my personal pharmacy.
Nuõ galvõs ikì kójų pir̃štų àš sutvérta méilei	Nuo galvos iki kojų pirštų aš sutverta meilei	From head to toe l'm programmed forlove
Norė́čiau jùms pristatýti víeną ypatìngą svẽčią,	Norėčiau jums pristatyti vieną ypatingą svečią,	I would like to introduce to you our very special guest for tonight,
Nuõ galvõs ikì kójų pir̃štų àš sutvérta méilei	Nuo galvos iki kojų pirštų aš sutverta meilei	From head to toe l'm programmed forlove
Tokià màno prìgimtis Galiù tìk mylė́ti	Tokia mano prigimtis Galiu tik mylėti	It is my nature I can only love
Sakýk, mielàsis, tù vìsąlaik taĩp knarkì?	Sakyk, mielasis, tu visąlaik taip knarki?	Say, sweetheart, do you always snore like this?
Àš jùs visùs į̃ kalė́jimą pasodìnsiu!	Aš jus visus į kalėjimą pasodinsiu!	I'll have you all put in jail!
Jū̃s kal̃bate apiẽ màno bū́simą žmóną!	Jūs kalbate apie mano būsimą žmoną!	You're talking about my future wife!
Ar̃ priim̃site šìtai kaĩp dóvaną nuõ manę̃s?	Ar priimsite šitai kaip dovaną nuo manęs?	Will you accept this as a present from me?
Ir̃ ar̃ galiù tuõ pačiù paprašýti jū́sų rañkos?	Ir ar galiu tuo pačiu paprašyti jūsų rankos?	And may I at the same time ask for your hand?
Tikiúosi, màno vaikè, suprantì šiõs prógos rimtùmą.	Tikiuosi, mano vaike, supranti šios progos rimtumą.	I hope, my child, you realize the seriousness of this occasion.
Màno vestùvės taĩp pàt bùvo labaĩ grãžios.	Mano vestuvės taip pat buvo labai gražios.	My wedding was beautiful, too.
Jìs vė̃l demonstruõs víeną sàvo triùkų.	Jis vėl demonstruos vieną savo triukų.	He'll do one of his tricks again.
Tõ nebùs, kõl àš turiù beñt ceñtą!	To nebus, kol aš turiu bent centą!	Not as long as I own a penny!
Bèt tàvo výras tàps dìdele žvaigždè!	Bet tavo vyras taps didele žvaigžde!	But your husband has become a big shot!
Pažiūrė́k į̃ kontrãktą, kurį̃ patvìrtinau telegrafù.	Pažiūrėk į kontraktą, kurį patvirtinau telegrafu.	Look at the contract, sealed via telegraph.
Niẽkad nemaniaũ, kàd vė̃l šliaũšiu į̃ šìtą skỹlę.	Niekad nemaniau, kad vėl šliaušiu į šitą skylę.	I'd never thought I'd be crawling back into this hole again.
Jū̃s taĩp pàt nenùmetėt daũg svõrio.	Jūs taip pat nenumetėt daug svorio.	You haven't lost much weight, either.
Dár pasimatýsim, bèt tikiúosi nè per̃ artimiáusius dẽšimt mẽtų.	Dar pasimatysim, bet tikiuosi ne per artimiausius dešimt metų.	See you, but not in the next ten years, I hope.
Dár saváitė sù juõ ir̃ bū́čiau galė́jęs bankrutúoti.	Dar savaitė su juo ir būčiau galėjęs bankrutuoti.	One more week with him, and I could have closed down.
Bèt visuomèt prisimiñk, kàd jì plėšrū̃nė Sáugokis blondìnių	Bet visuomet prisimink, kad ji plėšrūnė Saugokis blondinių	But always remember she's a predator watch out forblondes
Šìs vãkaras nulem̃s vìsą tàvo karjèrą.	Šis vakaras nulems visą tavo karjerą.	This evening will determine your whole career.
Jéi vãkaras geraĩ nusisèks, vadìnasi táu pavỹko.	Jei vakaras gerai nusiseks, vadinasi tau pavyko.	If everything goes well, you've got it made.
Àš taĩp pàt jaučiaũsi priẽš pìrmą pasiródymą.	Aš taip pat jaučiausi prieš pirmą pasirodymą.	I felt the same way the first time around.
Kaĩ pamataũ grãžią móterį, tampù agresyvùs.	Kai pamatau gražią moterį, tampu agresyvus.	When I see a beautiful woman, I go on the offensive.
Kaĩ tìk àš gẽros núotaikos, tù sténgiesi ją̃ sugadìnti!	Kai tik aš geros nuotaikos, tu stengiesi ją sugadinti!	Every time I'm in a good mood you try to spoil it!
Nà, taĩp bū̃na nèt ir̃ geriáusiose šeimosè!	Na, taip būna net ir geriausiose šeimose!	Well, that happens in the best families!
Põnai ir̃ põnios, prašaũ atleistì ùž vėlãvimą...	Ponai ir ponios, prašau atleisti už vėlavimą...	Ladies and gentlemen, I apologize for the delay...
Kaĩp mataũ, vìsiškai nereĩkia tolesnių̃ pristãtymų...	Kaip matau, visiškai nereikia tolesnių pristatymų...	I can see you don't need any further introduction...
Põnai ir̃ põnios, léiskite jùms pristatýti...	Ponai ir ponios, leiskite jums pristatyti...	Ladies and gentlemen, allow me to introduce to you...
Ar̃ bū́tumėt tóks malonùs ir̃ išbùrtumėt mán kelìs?	Ar būtumėt toks malonus ir išburtumėt man kelis?	Would you be so kind to conjure some up for me?
Ìš Augùsto nósies àš dabar̃ ištráuksiu kelìs kiaušiniùs.	Iš Augusto nosies aš dabar ištrauksiu kelis kiaušinius.	From under August's nose, I will now conjure up some eggs.
Jū̃s mãnote, kàd Augùstas tùri kiaušiniùs añt galvõs.	Jūs manote, kad Augustas turi kiaušinius ant galvos.	You all think August has the eggs under his head.
Nuõ galvõs ikì kójų pir̃štų àš sutvérta méilei	Nuo galvos iki kojų pirštų aš sutverta meilei	From head to toe l'm programmed forlove
Tokià màno prigimtìs... Àš tegaliù mylė́ti	Tokia mano prigimtis... Aš tegaliu mylėti	It is my nature... I can only love
Nuõ galvõs ikì kójų pir̃štų àš sutvérta méilei	Nuo galvos iki kojų pirštų aš sutverta meilei	From head to toe l'm programmed forlove
- Tùrime pasiektì smùklę ikì saulė́lydžio.	- Turime pasiekti smuklę iki saulėlydžio.	- We must reach the inn before sundown.
Atléiskite, bèt manè pasitiñka karietà vidùrnaktį Bòrgo pérėjoje.	Atleiskite, bet mane pasitinka karieta vidurnaktį Borgo perėjoje.	Well, I'm sorry, but there's a carriage meeting me at Borgo Pass at midnight.
Mẽs, kalnų̃ gyvéntojai, tikìme, kàd pilyjè ỹra vampỹrų!	Mes, kalnų gyventojai, tikime, kad pilyje yra vampyrų!	We people of the mountains believe... at the castle there are vampires!
Jiẽ įgỹja vilkų̃ ir̃ šikšnósparnių pavìdalą.	Jie įgyja vilkų ir šikšnosparnių pavidalą.	They take the form of wolves and bats.
Paliẽka sàvo karstùs nãktį ir̃ miñta gyvų̃jų kraujù.	Palieka savo karstus naktį ir minta gyvųjų krauju.	They leave their coffins at night... and they feed on the blood of the living.
Kaĩ jì pasislė̃ps, jiẽ palìks karstùs.	Kai ji pasislėps, jie paliks karstus.	When it is gone, they leave their coffins.
Paáiškinau vežìkui, kàd taĩ – ver̃slo reĩkalas.	Paaiškinau vežikui, kad tai – verslo reikalas.	I've explained to the driver that it's a matter of business with me.
Jéi privãlote važiúoti, dėvė́kite jį̃ vardañ sàvo mótinos.	Jei privalote važiuoti, dėvėkite jį vardan savo motinos.	If you must go, wear this, for your mother's sake.
Nežinaũ, kàs nutìko vežìkui ir̃ màno bagãžui...	Nežinau, kas nutiko vežikui ir mano bagažui...	I don't know what happened to the driver and my luggage and...
Esù tikràs, šì piliẽs dalìs jùms pasiródys svetingèsnė.	Esu tikras, ši pilies dalis jums pasirodys svetingesnė.	I'm sure you will find this part of my castle more inviting.
Mãtote, teñ bùvo visì jū́sų põpieriai.	Matote, ten buvo visi jūsų popieriai.	You see, all your papers were in...
Léidau sáu lieptì užneštì jū́sų bagãžą.	Leidau sau liepti užnešti jūsų bagažą.	I took the liberty of having your luggage brought up.
Tikiúosi, pàėmiau pakañkamai etikèčių jū́sų bagãžui.	Tikiuosi, paėmiau pakankamai etikečių jūsų bagažui.	Why, uh, I hope I've brought enough labels for your luggage.
Užsakiaũ laĩvą, kurìs mùs nugabeñs į̃ Ángliją.	Užsakiau laivą, kuris mus nugabens į Angliją.	I have chartered a ship to take us to England.
Šeimininkè, jùk ištesė́site sàvo pãžadą, kaĩ nusigáusime į̃ Lòndoną?	Šeimininke, juk ištesėsite savo pažadą, kai nusigausime į Londoną?	You will keep your promise when we get to London, won't you, Master?
Nè žmõgiškų, bèt menkų̃, tùrinčių kraũjo.	Ne žmogiškų, bet menkų, turinčių kraujo.	Not human lives, but small ones... with blood in them.
Niẽkas nèlipa į̃ laĩvą, tìk įgaliótieji.	Niekas nelipa į laivą, tik įgaliotieji.	Nobody goes aboard this here boat but the authorities.
Kaĩ pérduosi pranešìmą, nebeatsimiñsi niẽko, ką̃ dabar̃ sakiaũ.	Kai perduosi pranešimą, nebeatsiminsi nieko, ką dabar sakiau.	And after you deliver the message, you will remember nothing I now say.
- Kíek suprantù, jì šalià jū́sų žẽmių.	- Kiek suprantu, ji šalia jūsų žemių.	- I understand it adjoins your grounds.
Bùs smagù pamatýti šviẽsą tuosè niūriuosè senuosè languosè.	Bus smagu pamatyti šviesą tuose niūriuose senuose languose.	Oh, it'll be a relief to see light in those dismal old windows.
Jì mán prìmena apgriùvusias dantýtas màno piliẽs Transilvãnijoje síenas.	Ji man primena apgriuvusias dantytas mano pilies Transilvanijoje sienas.	It reminds me of the broken battlements... of my own castle in Transylvania.
Abatijà mán visadà prìmena tą̃ sẽną tòstą:	Abatija man visada primena tą seną tostą:	The abbey always reminds me of that old toast... about lofty timbers.
Ỹra daũg baisesnių̃ dalỹkų, láukiančių žmogaũs, neĩ mirtìs.	Yra daug baisesnių dalykų, laukiančių žmogaus, nei mirtis.	There are far worse things... awaiting man... than death.
Jì mán prìmena apgriùvusias dantýtas màno piliẽs Transilvãnijoje síenas.	Ji man primena apgriuvusias dantytas mano pilies Transilvanijoje sienas.	It reminds me... of the broken battlements... of my own castle in Transylvania.
Palìksiu tavè tàvo grãfui ir̃ jõ sugriùvusiai abatìjai.	Paliksiu tave tavo grafui ir jo sugriuvusiai abatijai.	I'll leave you to your count and his ruined abbey.
Nenatūralùs kraũjo netekìmas, kuriõ nepàjėgėme sulaikýti.	Nenatūralus kraujo netekimas, kurio nepajėgėme sulaikyti.	An unnatural loss of blood... which we've been powerless to check.
Jìs turbū́t vė̃l nóri sàvo mùsių!	Jis turbūt vėl nori savo musių!	He probably wants his flies again!
Nè tadà, kaĩ galiù gautì puĩkių, riebių̃ vorų̃!	Ne tada, kai galiu gauti puikių, riebių vorų!	Not when I can get nice, fat spiders!
Jìs paliẽka dvì žaizdelès, báltas, raudónu vìduriu.	Jis palieka dvi žaizdeles, baltas, raudonu viduriu.	It leaves two little wounds, white with red centers.
Bèt sãkote, kàd jìs pabė́ga ìš sàvo kam̃bario.	Bet sakote, kad jis pabėga iš savo kambario.	But you tell me that he escapes from his room.
Màno šauksmaĩ nãktį gãli trukdýti mìs Mìnai.	Mano šauksmai naktį gali trukdyti mis Minai.	My cries at night, they might disturb Miss Mina.
Bèt nemanaũ, kàd taĩp artì nuõ Lòndono ỹra vilkų̃.	Bet nemanau, kad taip arti nuo Londono yra vilkų.	But I hardly think there are wolves so near London.
Àš juõs girdė́jau kaũkiančius pràeitą nãktį.	Aš juos girdėjau kaukiančius praeitą naktį.	Me, I've heard 'em... howl at night before.
Kurį̃ láiką ìš jõ daugiaũ niẽko neišpèšime.	Kurį laiką iš jo daugiau nieko neišpešime.	We'll get no more out of him now for a while.
Kàs tà taĩp jį̃ sujáudinusi žolė̃?	Kas ta taip jį sujaudinusi žolė?	What was that herb that excited him so?
Viẽtiniai jį̃ naudója apsisáugoti nuõ vampỹrų.	Vietiniai jį naudoja apsisaugoti nuo vampyrų.	The natives there use it to protect themselves against vampires.
Kadà atsliñko sãpnas, atródė, kàd vìsą kam̃barį užpìldė miglà.	Kada atslinko sapnas, atrodė, kad visą kambarį užpildė migla.	And when the dream came, it seemed the whole room was filled with mist.
Galė́jau matýti tìk lémpą priẽ lóvos, kibirkštė̃lę rūkè.	Galėjau matyti tik lempą prie lovos, kibirkštėlę rūke.	I could just see the lamp by the bed, a tiny spark in the fog.
Pajutaũ jõ kvėpãvimą, õ põ tõ – jõ lū́pas.	Pajutau jo kvėpavimą, o po to – jo lūpas.	I felt its breath on my face, and then its lips.
Ródėsi, lýg visà gyvýbė bū́tų ìšsiurbta ìš manę̃s.	Rodėsi, lyg visa gyvybė būtų išsiurbta iš manęs.	It seemed as if all the life had been drained out of me.
Ar̃ ỹra kažkàs, kàs bū́tų galė́jęs užtrauktì šį̃ sãpną?	Ar yra kažkas, kas būtų galėjęs užtraukti šį sapną?	Is there anything that might have brought this dream on?
Daktarè, kažkàs neramìna Mìną, apiẽ ką̃ jì mùms nepãsakoja.	Daktare, kažkas neramina Miną, apie ką ji mums nepasakoja.	Doctor, there's something troubling Mina, something she won't tell us.
Véidas tamè sapnè, kaĩp sãkote, vìs artė́jo?	Veidas tame sapne, kaip sakote, vis artėjo?	And the face in the dream, you say it seemed to come closer and closer?
Kaĩp seniaĩ tùrite šiàs nedìdeles žymès?	Kaip seniai turite šias nedideles žymes?	How long have you had those little marks?
Õ jū̃s, mìs Minà, atródote ýpač...	O jūs, mis Mina, atrodote ypač...	And you, Miss Mina. You're looking exceptionally...
Žymùs mókslininkas, kuriõ var̃dą žìnome nètgi Transilvãnijos týruose.	Žymus mokslininkas, kurio vardą žinome netgi Transilvanijos tyruose.	A most distinguished scientist whose name we know... even in the wilds of Transylvania.
Tikiúosi, neprìėmėte màno pãsakojimų per̃ daũg rimtaĩ.	Tikiuosi, nepriėmėte mano pasakojimų per daug rimtai.	I hope you haven't taken my stories too seriously.
Geriaũ darýkite, kaĩp pàtaria jū́sų tė́vas.	Geriau darykite, kaip pataria jūsų tėvas.	You had better do as your father advises.
Príešingai, apsilañkymas gãli daũg ką̃ nušviestì.	Priešingai, apsilankymas gali daug ką nušviesti.	On the contrary, it may prove to be most enlightening.
Taĩp, šìtaip pažvel̃gtų ir̃ jū́sų ángliški daktaraĩ, jū́sų polìcija.	Taip, šitaip pažvelgtų ir jūsų angliški daktarai, jūsų policija.	Yes, and that is what your English doctors would say, your police.
Profèsoriau, vampỹrai egzistúoja tìk gą̃sdinančiose istòrijose.	Profesoriau, vampyrai egzistuoja tik gąsdinančiose istorijose.	Professor, vampires only exist in ghost stories.
Jìs tùri gautì kraũjo, arbà žùs.	Jis turi gauti kraujo, arba žus.	It must have blood or it dies.
Jìs tùri gãlią tìk nuõ saulė́lydžio ikì saulė́tekio.	Jis turi galią tik nuo saulėlydžio iki saulėtekio.	Its power lasts only from sunset to sunrise.
Dienõs valandomìs jìs tùri ilsė́tis žẽmėje, kuriojè bùvo paláidotas.	Dienos valandomis jis turi ilsėtis žemėje, kurioje buvo palaidotas.	During the hours of the day, it must rest in the earth in which it was buried.
Jìs turė́jo atsivèžti gim̃tojo dirvóžemio, pìlnas dėžès.	Jis turėjo atsivežti gimtojo dirvožemio, pilnas dėžes.	Then he must have brought his native soil with him, boxes of it.
Dėžès žẽmės, pakañkamai dìdeles, kàd galė́tų josè ilsė́tis.	Dėžes žemės, pakankamai dideles, kad galėtų jose ilsėtis.	Boxes of earth large enough for him to rest in.
Mir̃site kančiosè, jéi jū́sų síela bùs sùtepta nekaltù kraujù.	Mirsite kančiose, jei jūsų siela bus sutepta nekaltu krauju.	You will die in torment if you die with innocent blood on your soul.
- Mìs Mìna štaĩ teñ negýva!	- Mis Mina štai ten negyva!	- Miss Mina, out there dead!
Jaũ negeraĩ, kàd jì apiẽ taĩ skaĩtė laĩkraštyje.	Jau negerai, kad ji apie tai skaitė laikraštyje.	It's bad enough for her to read it in the newspaper...
Jì išnìro ìš šešė́lių ir̃ sustójo, žvelgdamà į̃ manè.	Ji išniro iš šešėlių ir sustojo, žvelgdama į mane.	She came out of the shadows and stood looking at me.
Tadà jõs véido ìšraiška tãpo siaubìnga.	Tada jos veido išraiška tapo siaubinga.	The most horrible expression came over her face.
Tadà jì apsisùko ir̃ nubė́go į̃ tam̃są.	Tada ji apsisuko ir nubėgo į tamsą.	And then she turned and ran back into the dark.
Tadà, žìnote, kàd baltaĩ apsireñgusi móteris ỹra	Tada, žinote, kad baltai apsirengusi moteris yra	Then you know the woman in white is...
Tuõj diñgs paskutìniai sáulės spinduliaĩ, mùs vė̃l apgaũbs naktìs.	Tuoj dings paskutiniai saulės spinduliai, mus vėl apgaubs naktis.	The last rays of the day's sun will soon be gone, and another night will be upon us.
- Jókiu būdù šią̃nakt negãlima atidarýti šių̃ langų̃.	- Jokiu būdu šiąnakt negalima atidaryti šių langų.	- And under no circumstances... must these windows be opened tonight.
Jéi atim̃site ìš jõs mū́sų ãpsaugą, ją̃ nužudýsite.	Jei atimsite iš jos mūsų apsaugą, ją nužudysite.	If you take her from under our protection, you will kill her.
Ar̃ taĩ nè keistàs pókalbis neišprotė́jusiems žmonė́ms?	Ar tai ne keistas pokalbis neišprotėjusiems žmonėms?	Isn't this a strange conversation... for men who aren't crazy?
Daktarè, pamir̃štate, kàd beprõčiai labaĩ stìprūs.	Daktare, pamirštate, kad bepročiai labai stiprūs.	You forget, Doctor, that madmen have great strength.
