Jéi jìs suràs kẽturias bandìtų divìzijas... ir̃ pasitraũks.	Jei jis suras keturias banditų divizijas... ir pasitrauks.	If he finds he's using four divisions to fend off a handf ul of bandits... he'll withdraw.
Kàd mẽs išvarýsime Turkùs, õ pãtys teñ ateĩsime.	Kad mes išvarysime Turkus, o patys ten ateisime.	That we'll let them drive the Turks out and then move in ourselves.
Dúok jíems artilèriją, ir̃ jiẽ tàps nepriklaũsomi.	Duok jiems artileriją, ir jie taps nepriklausomi.	Give them artillery and you've made them independent.
Tadà àš negaliù jíems jõs duotì, tiesà?	Tada aš negaliu jiems jos duoti, tiesa?	Then I can't give it to them, can I?
Àš turiù nuródymus paklusìmui, ãčiū Diẽvui.	Aš turiu nurodymus paklusimui, ačiū Dievui.	I've got orders to obey, thank God.
Žinaũ, kàd jùms nèdavė jokiõs artilèrijos.	Žinau, kad jums nedavė jokios artilerijos.	I know you've been given no artillery.
Taĩ ribója mùs nuõ mažų̃ dalỹkų.	Tai riboja mus nuo mažų dalykų.	It restricts us to small things.
Jū́sų šviesýbe, mẽs, Amerikiẽčiai, kar̃tą bùvome kolonijìniai.	Jūsų šviesybe, mes, Amerikiečiai, kartą buvome kolonijiniai.	Your Highness, we Americans were once a colonial people.
À, dabar̃ jū̃s kal̃bate kvailaĩ, tiesà?	A, dabar jūs kalbate kvailai, tiesa?	Ah, now you are talking turkey, are you not?
Ir̃ priẽš màno išėjìmą... kurìs tuõj bùs...	Ir prieš mano išėjimą... kuris tuoj bus...	And before I leave here... which must be presently...
Užrašýsiu jùms kẽletą fãktų ir̃ figū̃rų.	Užrašysiu jums keletą faktų ir figūrų.	I will have some facts and figures put on paper for you.
Màno ármija ỹra sudarýta ìš genčių̃.	Mano armija yra sudaryta iš genčių.	My army is made up of tribes.
Geñtys ỹra vẽdamos jų̃ genčių̃ lýderių.	Gentys yra vedamos jų genčių lyderių.	The tribes are led by the tribal leaders.
Jū̃s íeškote figū̃ros, kurì išsių̃s jū́sų šãlį į̃ kãrą.	Jūs ieškote figūros, kuri išsiųs jūsų šalį į karą.	You look for a figure who will draw your country towards war.
Niekadà nemačiaũ žmogaũs, nužudýto sù kardù.	Niekada nemačiau žmogaus, nužudyto su kardu.	Never seen a man killed with a sword before.
Tù naudóji sàvo devýnias gyvýbes labaĩ spar̃čiai.	Tu naudoji savo devynias gyvybes labai sparčiai.	You are using up your nine lives very quickly.
Jìs màno, jóg šiẽ dalỹkai pavõgs jõ gãlią.	Jis mano, jog šie dalykai pavogs jo galią.	He thinks these things will steal his virtue.
Jìs màno, jóg tù šióks tóks vagìs.	Jis mano, jog tu šioks toks vagis.	He thinks you're a kind of thief.
Jiẽ manè gãli nužudýti tìk sù áuksine kulkà.	Jie mane gali nužudyti tik su auksine kulka.	They can only kill me with a golden bullet.
Pasakýsiu jùms tadà, kaĩ jaũ turė́siu šãlį.	Pasakysiu jums tada, kai jau turėsiu šalį.	I will tell you that when I have a country.
Mán bū́tų įdomù jùs išgirstì, sãkant kláusimą tiẽsiai šviẽsiai.	Man būtų įdomu jus išgirsti, sakant klausimą tiesiai šviesiai.	I'd be interested to hear you put a question straight.
Kõ, jū́sų núomone, šiẽ žmónės tìkisi gautì laimė́ję kãrą?	Ko, jūsų nuomone, šie žmonės tikisi gauti laimėję karą?	What, in your opinion, do these people hope to gain from this war?
Nà, dabar̃... taĩ labaĩ apšviẽčiantis atsãkymas.	Na, dabar... tai labai apšviečiantis atsakymas.	Well, now... that's a very illuminating answer.
Ar̃ galė́čiau... padarýti víeną atsisvéikinimo núotrauką?	Ar galėčiau... padaryti vieną atsisveikinimo nuotrauką?	May I... take one farewell picture?
Dabar̃ jaũ gãli susprogdìnti màno tráukinį.	Dabar jau gali susprogdinti mano traukinį.	Now you may blow up my train.
Jiẽ nèš ir̃ màno žaisliukùs, mãtote?	Jie neš ir mano žaisliukus, matote?	They will carry my toys too, see?
Bèt jū̃s gavòte kõ norė́jote, ir̃ grį̃šite namõ, tiesà?	Bet jūs gavote ko norėjote, ir grįšite namo, tiesa?	But you got what you wanted, so you're going home, is that it?
Tadà teñ ỹra Arãbų šiáurės ármija.	Tada ten yra Arabų šiaurės armija.	Then there is an Arab north army.
- Nè, serè. Jìs apiẽ taĩ melãvo	- Ne, sere. Jis apie tai melavo	- No, sir, he has lied about that.
- Taĩ ỹra jõ ármija, manaũ.	- Tai yra jo armija, manau.	- It's his army, I suppose.
- Nà, jìs ỹra drąsùs výras.	- Na, jis yra drąsus vyras.	- Well, he's a brave man--
Dár vienà klaidà ir̃ tù lìksi víenas.	Dar viena klaida ir tu liksi vienas.	One more failure and you will find yourself alone.
Dár priežastìs būtì taupiam̃ sù jaĩs.	Dar priežastis būti taupiam su jais.	The more reason to be thrifty with them.
Dúok jíems dárbo, kurìs gãli būtì àtliktas.	Duok jiems darbo, kuris gali būti atliktas.	Give them something to do that can be done.
Jiẽ tùri jùdinti kálnus, váikščioti añt vandeñs.	Jie turi judinti kalnus, vaikščioti ant vandens.	They must move mountains, walk on water.
Màno draugaĩ, kuriẽ váikščios vandenimì sù manimì?	Mano draugai, kurie vaikščios vandenimi su manimi?	My friends, who will walk on water with me?
Ar̃ galbū́t tù esì čià... dė̃l Ánglų generõlų.	Ar galbūt tu esi čia... dėl Anglų generolų.	Or perhaps you are here... for the English generals.
Ar̃ gãli praeitì prõ Arabùs Arãbų miestè?	Ar gali praeiti pro Arabus Arabų mieste?	Can you pass for an Arab in an Arab town?
Jéi víenas ìš jū́sų paskõlintų mán nešvarių̃ drabùžių.	Jei vienas iš jūsų paskolintų man nešvarių drabužių.	If one of you would lend me some dirty clothes.
Tù tùri kū́ną, kaĩp ir̃ kitì žmónės.	Tu turi kūną, kaip ir kiti žmonės.	You have a body, like other men.
Àš atėjaũ į̃ sàvo pãbaigą, manýčiau.	Aš atėjau į savo pabaigą, manyčiau.	I've come to the end of myself, I suppose.
Žmogùs gãli būtì kuõ tìk nóri.	Žmogus gali būti kuo tik nori.	A man can be whatever he wants.
Ir̃ dė̃l tõ niẽko negaliù padarýti.	Ir dėl to nieko negaliu padaryti.	And there's nothing I can do about it.
Žmogùs gãli padarýti ką̃ tìk nóri.	Žmogus gali padaryti ką tik nori.	A man can do whatever he wants.
Taĩ ỹra dalỹkas, kurìs nuspréndžia, kõ jìs nóri.	Tai yra dalykas, kuris nusprendžia, ko jis nori.	This is the stuff that decides what he wants.
Žiūrė́k, Ãli, mataũ kẽlią būtì tìk... paprastaĩ... laimìngu.	Žiūrėk, Ali, matau kelią būti tik... paprastai... laimingu.	Look, Ali, I think I see a way of being just... ordinarily... happy.
- Sakýčiau, nepamir̃šk tų̃ penkių̃ fòrmų.	- Sakyčiau, nepamiršk tų penkių formų.	- I say, don't forget those form fives.
Àš sakiaũ, jóg tokià sutartìs neegzistúoja.	Aš sakiau, jog tokia sutartis neegzistuoja.	I told you, no such treaty exists.
Taĩp, generolè, jū̃s melãvote labaĩ drą̃siai, bèt neįtìkinamai.	Taip, generole, jūs melavote labai drąsiai, bet neįtikinamai.	Yes, general, you have lied most bravely, but not convincingly.
Àš žinaũ, jóg šì sutartìs egzistúoja.	Aš žinau, jog ši sutartis egzistuoja.	I know this treaty does exist.
Jìs taĩ dãro geriaũ, neĩ jū̃s, generolè.	Jis tai daro geriau, nei jūs, generole.	He does it better than you, general.
Bèt tadà, žìnoma, jìs ỹra bevéik Arãbas.	Bet tada, žinoma, jis yra beveik Arabas.	But then, of course, he is almost an Arab.
Taĩ màno prãšymas paleistì Arãbiją, serè.	Tai mano prašymas paleisti Arabiją, sere.	It's my request for release from Arabia, sir.
Prancūzijà ir̃ Ánglija pasidaliñs Tur̃kų impèriją.	Prancūzija ir Anglija pasidalins Turkų imperiją.	France and England should share the Turkish Empire.
Jū̃s galė́jote nežinóti, bèt tikraĩ turė́jote įtarìmų.	Jūs galėjote nežinoti, bet tikrai turėjote įtarimų.	You may not have known, but you certainly had suspicions.
Jéi mẽs melãvome, mẽs kalbė́jome pusiáu mẽlą.	Jei mes melavome, mes kalbėjome pusiau melą.	If we've told lies, you've told half-lies.
Ir̃ žmogùs kurìs melúoja, kaĩp àš, slẽpia tiẽsą.	Ir žmogus kuris meluoja, kaip aš, slepia tiesą.	And a man who tells lies, like me, merely hides the truth.
Tiesà ỹra tà, kàd àš esù pàprastas žmogùs.	Tiesa yra ta, kad aš esu paprastas žmogus.	The truth is I'm an ordinary man.
Léisk mán žinóti, ar̃ tàs žmogùs bėdojè.	Leisk man žinoti, ar tas žmogus bėdoje.	Let me know if the man's in trouble.
- Àš padariaũ tą̃ berniùką heròjumi.	- Aš padariau tą berniuką herojumi.	- I've made that boy a hero.
Kaĩ kãras baĩgsis, jìs galė̃s būtì kuõ tìk nóri.	Kai karas baigsis, jis galės būti kuo tik nori.	When the war's over, he can be anything he wants.
Nà, šiuõ metù, jìs nóri būtì kažkuõ kitù.	Na, šiuo metu, jis nori būti kažkuo kitu.	Well, at the moment he wants to be somebody else.
Jū̃s ẽsate pàts keisčiáusias žmogùs, kurį̃ kadà esù sutìkęs.	Jūs esate pats keisčiausias žmogus, kurį kada esu sutikęs.	You're the most extraordinary man I ever met.
Taĩ baisùs dalỹkas žmógui, jéi jìs nuõ jõ išsisukinė́ja.	Tai baisus dalykas žmogui, jei jis nuo jo išsisukinėja.	It's a terrible thing for a man to funk it if he has.
Jiẽ neĩs dė̃l pinigų̃, nè didžióji dalìs.	Jie neis dėl pinigų, ne didžioji dalis.	They won't be coming for money, not the best of them.
Vìskas kõ nórite, ỹra kažkàs, kàs sulaikýtų Tur̃kų Dẽšinę.	Viskas ko norite, yra kažkas, kas sulaikytų Turkų Dešinę.	All you want is someone holding down the Turkish Right.
Pasakýkite polìtikams, kàd sudẽgintų sàvo põpierius.	Pasakykite politikams, kad sudegintų savo popierius.	Tell the politicians to burn their paper now.
Didžióji dalìs vỹks nè dė̃l pinigų̃.	Didžioji dalis vyks ne dėl pinigų.	The best of them won't come for money.
Ką̃ Ánglų generõlas padãrė jám Jerùzalėje?	Ką Anglų generolas padarė jam Jeruzalėje?	What did the English do to him in Jerusalem?
Čià nėrà žmogaũs, bè káinos añt galvõs.	Čia nėra žmogaus, be kainos ant galvos.	There is not a man without a price on his head.
- Ir̃ añt màno galvõs ỹra káina.	- Ir ant mano galvos yra kaina.	- There's a price on my head too.
- Àš pusè výru čià nusipirkaũ, Ãli.	- Aš puse vyru čia nusipirkau, Ali.	- I bought half the men here, Ali.
Šì arãbų ármija dešinėjè, serè, ìš kõ jì sudarýta?	Ši arabų armija dešinėje, sere, iš ko ji sudaryta?	This Arab army on the right, sir, what's it consist of?
Tepàdeda Diẽvas žmonė́ms, kuriẽ gùli põ tuõ.	Tepadeda Dievas žmonėms, kurie guli po tuo.	God help the men who lie under that.
Nà, jìs tùri ką́snį tar̃p dantų̃ ganà gẽrą.	Na, jis turi kąsnį tarp dantų gana gerą.	Well, he's got the bit between his teeth all right.
Jìs tùri ką́snį tar̃p sàvo dantų̃ ganà gẽrą.	Jis turi kąsnį tarp savo dantų gana gerą.	He's got the bit between his teeth all right.
Žìnoma žìnote, kàd Arãbai ỹra bárbariški žmónės.	Žinoma žinote, kad Arabai yra barbariški žmonės.	Surely you know the Arabs are a barbarous people.
Štaĩ, léisk mán paimtì tàvo supùvusią krùviną núotrauką.	Štai, leisk man paimti tavo supuvusią kruviną nuotrauką.	Here, let me take your rotten bloody picture.
Jiẽ bùvo čià diẽną ir̃ nãktį.	Jie buvo čia dieną ir naktį.	They've been here a day and a night.
Jìs pasistatỹs sàvo štãbą miẽsto rõtušėje.	Jis pasistatys savo štabą miesto rotušėje.	He's set up his own headquarters in the town hall.
Nà, jiẽ ỹra tàvo balañdžiai, Hãri.	Na, jie yra tavo balandžiai, Hari.	Well, they're your pigeon, Harry.
Dvì diẽnos ỹra taĩ, kõ prãšėte.	Dvi dienos yra tai, ko prašėte.	Two days is what you asked for.
Jiẽ nedir̃bs, nès jíems neduodamà elèktros.	Jie nedirbs, nes jiems neduodama elektros.	They will not work because they are given no electricity.
Jéi atsakýsi, čià bùs kraũjo praliejìmas.	Jei atsakysi, čia bus kraujo praliejimas.	If you answer, there will be bloodshed.
Sù manimì kalbì apiẽ kraũjo praliejìmą?	Su manimi kalbi apie kraujo praliejimą?	You speak to me of bloodshed?
- Tadà mùms reĩkia Ánglų inžiniẽrių.	- Tada mums reikia Anglų inžinierių.	- Then we need English engineers.
Paimtì Ánglų inžiniẽrius réiškia paimtì Ánglų val̃džią.	Paimti Anglų inžinierius reiškia paimti Anglų valdžią.	Take English engineers and you take English government.
Mẽs bañdėme, bèt vandẽnyje nėrà jėgõs.	Mes bandėme, bet vandenyje nėra jėgos.	We have tried, but there is no force in the water.
- Àš prisiim̃siu jį̃ põ kãro.	- Aš prisiimsiu jį po karo.	- I'll take this up after the war.
- Žìnoma mẽs tùrime kažką̃ darýti, serè.	- Žinoma mes turime kažką daryti, sere.	- Surely we should do something, sir.
Nè, àš čià lìksiu ir̃ išmóksiu polìtikos.	Ne, aš čia liksiu ir išmoksiu politikos.	No, I shall stay here and learn politics.
Visaĩs màno mẽtais, niekadà niẽko panašaũs nemačiaũ.	Visais mano metais, niekada nieko panašaus nemačiau.	In all my years, I've never seen anything like it.
Taĩ ateĩna sù Arãbų Tarýbos teisingumù.	Tai ateina su Arabų Tarybos teisingumu.	It comes within the jurisdiction of the Arab Council.
Bèt kokiomìs są́lygomis, tù privalaĩ paklustì gautíems įsãkymams.	Bet kokiomis sąlygomis, tu privalai paklusti gautiems įsakymams.	Under any circumstances at all, you must obey your orders.
Mẽs padãrėme taĩ, ką̃ galė́jome civìlinėse ligóninėse.	Mes padarėme tai, ką galėjome civilinėse ligoninėse.	We did what we could in the civic hospitals.
Bèt jū̃s pamir̃šote Tur̃kų Karìnę Ligóninę.	Bet jūs pamiršote Turkų Karinę Ligoninę.	But you forgot the Turkish Military Hospital.
Ùž visùs juõs atsakìnga Arãbų Tarýba.	Už visus juos atsakinga Arabų Taryba.	All of whom are the responsibility of your precious Arab Council.
Kíek žmonių̃ galė̃s užsitarnáuti vartóti šią̃ frãzę?	Kiek žmonių galės užsitarnauti vartoti šią frazę?	How many men will claim the right to use that phrase?
Jìs il̃gisi sàvo gimtõsios žẽmės žalumõs.	Jis ilgisi savo gimtosios žemės žalumos.	He longs for the greenness of his native land.
Kaĩp pul̃kininkas, turė́site namẽlį namiẽ laivè.	Kaip pulkininkas, turėsite namelį namie laive.	As a colonel, you'll have a cabin to yourself on the boat home.
Elèktros nãmas, telefònų mainaĩ, juõs àš suteikiù.	Elektros namas, telefonų mainai, juos aš suteikiu.	The powerhouse, the telephone exchange, these I concede.
- Turė́čiau būtì dėkìngas ùž pagálbą.	- Turėčiau būti dėkingas už pagalbą.	- I shall be glad of assistance.
- Tadà tùrite nuleistì sàvo vė̃liavą.	- Tada turite nuleisti savo vėliavą.	- Then you must bring down your flag.
Taĩ dalỹkas, kurìs pãdaro bjaũrų incideñtą.	Tai dalykas, kuris padaro bjaurų incidentą.	It's a thing that makes an ugly incident.
Ar̃ galiù jùms paspaustì rañką, serè?	Ar galiu jums paspausti ranką, sere?	May I shake your hand, sir?
Tiesióg nóriu galė́ti pasakýti, kàd taĩ padariaũ, serè.	Tiesiog noriu galėti pasakyti, kad tai padariau, sere.	Just want to be able to say I'd done it, sir.
Nè, nè, serè, àš taĩ turė́čiau prisimiñti.	Ne, ne, sere, aš tai turėčiau prisiminti.	No, no, sir, I should remember that.
Ýpač... kaĩ jiẽ pàima tõ fòrmą.	Ypač... kai jie paima to formą.	Particularly... when they take this form.
Pasáulis ỹra pamalõnintas Damãsko núotrauka... išláisvinta Arãbų ármijos.	Pasaulis yra pamalonintas Damasko nuotrauka... išlaisvinta Arabų armijos.	The world is delighted at the picture of Damascus... liberated by the Arab army.
Galiù jùms primintì, ìš brìtams tarnáujančio pareigū̃no.	Galiu jums priminti, iš britams tarnaujančio pareigūno.	Led, may I remind you, by a British-serving officer.
Mẽs taĩp pàt džiaũgiamės jõ atsikratýdami, tiesà?	Mes taip pat džiaugiamės jo atsikratydami, tiesa?	We are equally glad to be rid of him, are we not?
Maniaũ, jóg esù sunkùs žmogùs, serè.	Maniau, jog esu sunkus žmogus, sere.	I thought I was a hard man, sir.
Jū̃s, àš įtariù... ẽsate pagrindìnis architèktas šiõ kompromìso.	Jūs, aš įtariu... esate pagrindinis architektas šio kompromiso.	You, I suspect... are chief architect of this compromise.
Mačiaũ, kaĩp per̃ líetų tampeĩ dėžès. Baĩsiai juokìnga.	Mačiau, kaip per lietų tampei dėžes. Baisiai juokinga.	I watch you with all the boxes in the rain.
Nà geraĩ, pasiim̃k manè kaĩp virė́ją.	Na gerai, pasiimk mane kaip virėją.	All right, take me as a cook.
Màno tė́vas bùvo graĩkas, bèt gimiaũ Ánglijoje.	Mano tėvas buvo graikas, bet gimiau Anglijoje.	My father was Greek, but I was born in England.
Jéi reĩkia, galiù būtì ir̃ virė́jas.	Jei reikia, galiu būti ir virėjas.	If you need one, I am.
Jū̃s tìk jõ paklausýkit. Turiù gálvą, rankàs, kójas.	Jūs tik jo paklausykit. Turiu galvą, rankas, kojas.	Listen to him. I got hands, feet, head.
Õ kóks bùvo tàvo paskutìnis dárbas?	O koks buvo tavo paskutinis darbas?	Well then, what was the most recent?
Bèt susìmušiau sù bosù ir̃ manè ìšmetė.	Bet susimušiau su bosu ir mane išmetė.	But I beat up the boss, and they kicked me out.
- Išgérsiu arbãtos, jéi tù nè priẽš.	- Išgersiu arbatos, jei tu ne prieš.	-l'll have some tea, if you don't mind.
Protìngi žmónės ir̃ pardavė́jai vìską pàsveria.	Protingi žmonės ir pardavėjai viską pasveria.	Clever people and grocers, they weigh everything.
- Turiù ir̃ kitų̃ vardų̃, jéi táu įdomù.	- Turiu ir kitų vardų, jei tau įdomu.	-l have other names, if you are interested.
Ar̃ galiù paklaustì, ką̃ ketìni veiktì Krètoje?	Ar galiu paklausti, ką ketini veikti Kretoje?	And you, what are you go to do in Crete? With your permission.
Jaũ kelìs mė́nesius neparašiaũ nė̃ žõdžio.	Jau kelis mėnesius neparašiau nė žodžio.	I haven't written anything in months.
Mū́sų valdosè ỹra sẽna kasyklà. Tikraĩ?	Mūsų valdose yra sena kasykla. Tikrai?	On this land, there's an old mine.
Taĩ į̃ kurią̃ pùsę jõs pakrỹpo?	Tai į kurią pusę jos pakrypo?	Which way is it going?
Nesù labaĩ turtìngas, mán reikė̃s patýrusio žmogaũs.	Nesu labai turtingas, man reikės patyrusio žmogaus.	l'm not very rich, and I will need someone with experience.
Kaĩ Zòrba ìmasi dárbo, sùklesti bèt kokià kasyklà.	Kai Zorba imasi darbo, suklesti bet kokia kasykla.	When Zorba goes to work no mine stands a chance.
Ir̃ geraĩ káimui, kaĩp suprataũ, jìs neturtìngas.	Ir gerai kaimui, kaip supratau, jis neturtingas.	Also, it'll be good for the village. I understand it's rather poor.
Jéi čià ỹra našlių̃, šeimininkè, nesirū́pinkit.	Jei čia yra našlių, šeimininke, nesirūpinkit.	Boss, if there is a widow around, don't worry.
Buvaũ įsimylė́jusi admirõlą. Kur̃ keliãvo jìs, teñ ir̃ àš.	Buvau įsimylėjusi admirolą. Kur keliavo jis, ten ir aš.	I was in love with the admiral and where he go, I go.
- Brangióji karalíene, meldžiù tęstì. - Taĩp.	- Brangioji karaliene, meldžiu tęsti. - Taip.	-My darling queen, please continue.
Norė́dami manè atgaivìnti jiẽ láistė manè šampanù.	Norėdami mane atgaivinti jie laistė mane šampanu.	All the time they pour champagne over me to make me fresh.
Jì bùvo dìdvyrė karè sù tur̃kais. Ar̃ nè, šeimininkè?	Ji buvo didvyrė kare su turkais. Ar ne, šeimininke?	She was a big hero in the war against the Turks.
Bùvo pasirašýta taikõs sutartìs ir̃ laĩvas turė́jo išplauktì.	Buvo pasirašyta taikos sutartis ir laivas turėjo išplaukti.	They make the peace and the ship must go away.
Visų̃ keturių̃ kvepalaĩ susimaĩšę vienì sù kitaĩs.	Visų keturių kvepalai susimaišę vieni su kitais.	All their perfume one on top of the other.
Mačiaũ jõs akìs, kaĩ į̃ tavè pasižiūrė́jo.	Mačiau jos akis, kai į tave pasižiūrėjo.	I saw her eyes when she looked at you.
Šeimininkè, kám Diẽvas mùms dãvė rankàs?	Šeimininke, kam Dievas mums davė rankas?	-Boss. Why did God give us hands?
Gyvénti - réiškia ieškóti nemalonùmų. Nà?	Gyventi - reiškia ieškoti nemalonumų. Na?	To be alive is to undo your belt and look for trouble.
Jiẽ vidujè palìko kirviùs, štaĩ kàs!	Jie viduje paliko kirvius, štai kas!	They left axes inside, that's what.
Zòrba, nekìbk priẽ jų̃! - Kir̃viai kainúoja pìnigus.	Zorba, nekibk prie jų! - Kirviai kainuoja pinigus.	Zorba, leave them alone!
Àš tìk džiaugiúosi, kàd niẽkas nenukentė́jo.	Aš tik džiaugiuosi, kad niekas nenukentėjo.	Right now I'm just glad that nobody's hurt.
Reĩkia rastì tvirtų̃ mẽdžių ir̃ sutvìrtinti tùnelius.	Reikia rasti tvirtų medžių ir sutvirtinti tunelius.	We've got to find some strong trees to make beams for the galleries.
Kaĩ jausmaĩ nebètelpa krūtìnėj, kàs beliẽka?	Kai jausmai nebetelpa krūtinėj, kas belieka?	When a man is full what can he do?
Bèt tìk šõkis... Tìk šõkis numal̃dė màno skaũsmą.	Bet tik šokis... Tik šokis numaldė mano skausmą.	But it was the dancing only the dancing that stopped the pain.
- Turiù plãną. - Kókį plãną?	- Turiu planą. - Kokį planą?	-l got a plan.
Prisìmeni plãną, apiẽ kurį̃ negalė́jau pasãkot?	Prisimeni planą, apie kurį negalėjau pasakot?	Do you remember that plan I could not tell you about?
Jìs ỹra vienuolýno, õ vienuolýnas ỹra Diẽvo.	Jis yra vienuolyno, o vienuolynas yra Dievo.	What does that mean? It belongs to the monastery. The monastery belongs to God.
Ìš pradžių̃ sutvarkýsim kasỹklą, pãskui atidarýsim leñtpjūvę.	Iš pradžių sutvarkysim kasyklą, paskui atidarysim lentpjūvę.	First we get the mine going. Then open a timber factory.
Tàpsim vélniškai turtìngi, pasistatýsim laĩvą ir̃ išplaũksim apliñk pasáulį.	Tapsim velniškai turtingi, pasistatysim laivą ir išplauksim aplink pasaulį.	We get stinking rich, then make our own ship and sail around the world.
Sãko, kàd mẽtai užgesìna žmogujè dẽgančią ùgnį.	Sako, kad metai užgesina žmoguje degančią ugnį.	You know, they- - They say that age kills the fire inside of a man.
Manyjè pakañkamai ugniẽs sudẽginti vìsa pasáulį.	Manyje pakankamai ugnies sudeginti visa pasaulį.	I've got enough fight in me to devour the world.
Bèt verčiaũ atràstum sàvo gar̃sųjį kam̃pą.	Bet verčiau atrastum savo garsųjį kampą.	Well, I wish instead you'd discover your famous angle.
Tìk nóriu primintì, kàd rytój Kalė̃dos.	Tik noriu priminti, kad rytoj Kalėdos.	Just let me remind you that tomorrow's Christmas.
Šeimininkè, dabar̃ galiù atskleĩst táu pãslaptį.	Šeimininke, dabar galiu atskleist tau paslaptį.	Boss, now I can tell you a secret.
Daũg dienų̃ negalė́jau dirbtì, negalė́jau miegóti.	Daug dienų negalėjau dirbti, negalėjau miegoti.	All these days I couldn't work, I couldn't sleep.
Bèt negalė́jau pakeltì mintiẽs, kàd jì niẽko netùri.	Bet negalėjau pakelti minties, kad ji nieko neturi.	But to think of her without anybody that was too much.
Juõkis, juõkis, bèt atsimiñk víeną dalỹką.	Juokis, juokis, bet atsimink vieną dalyką.	All right, laugh, but remember this.
Jéi móteris miẽga vienà, taĩ užtráukia gė́da visíem výram.	Jei moteris miega viena, tai užtraukia gėda visiem vyram.	If a woman sleeps alone, it puts a shame on all men.
Jéi móteris kviẽčiasi výrą į̃ lóvą, õ jìs atsisãko.	Jei moteris kviečiasi vyrą į lovą, o jis atsisako.	If a woman calls a man to her bed and he will not go.
Žinaũ, víenas senàs išmintìngas tur̃kas mán pasãkė.	Žinau, vienas senas išmintingas turkas man pasakė.	I know, because a very wise, old Turk told me.
- Kàs čià kvaĩla káutis ùž sàvo šãlį?	- Kas čia kvaila kautis už savo šalį?	What's so stupid about...
Tačiaũ kaĩ kalbì... Stebė́jau tàvo rankàs, kójas, krūtìnę.	Tačiau kai kalbi... Stebėjau tavo rankas, kojas, krūtinę.	But when you talk I watch your arms your legs, your chest.
Manaũ, táu nusišvil̃pt į̃ tàvo šãlį.	Manau, tau nusišvilpt į tavo šalį.	I don't believe you give a damn about your country.
Nès jiẽ bùvo tur̃kai arbà bulgãrai.	Nes jie buvo turkai arba bulgarai.	Because they were Turks or Bulgarians.
Galiáusiai visì baĩgia taĩp pàt - tam̃pa kirminų̃ maistù.	Galiausiai visi baigia taip pat - tampa kirminų maistu.	They all end up the same way food for worms.
Kaĩ dė̃l móterų... Šaipaĩsi, kàd jàs mýliu.	Kai dėl moterų... Šaipaisi, kad jas myliu.	And as for women, you make fun of me that I love them.
