Šiuõ ãtveju, àš suprantù skalìko póžiūrį.	Šiuo atveju, aš suprantu skaliko požiūrį.	I understand the hound's point of view too.
Tadà jìs pradė́jo skleistì mẽlą spáusdindamas lankstinukùs.	Tada jis pradėjo skleisti melą spausdindamas lankstinukus.	And even after that, he continued to print scandal sheets in a cellar.
Vìktorai, jáučiu, kàd mùms nereĩktų čià liktì.	Viktorai, jaučiu, kad mums nereiktų čia likti.	Victor, I feel somehow we shouldn't stay here.
Jéi mẽs taĩp greĩt išeĩsime, atkreĩpsime dė̃mesį.	Jei mes taip greit išeisime, atkreipsime dėmesį.	If we'd walk out so soon it'd only call attention to us.
Esù įsitìkinęs, kàd jū̃s norė́tumėte nusipir̃kti šį̃ žíedą.	Esu įsitikinęs, kad jūs norėtumėte nusipirkti šį žiedą.	You'll find a market for this ring.
Žíedo nepir̃ksime, bèt malonù, kàd paródėte.	Žiedo nepirksime, bet malonu, kad parodėte.	We don't want the ring, but thank you for showing it to us.
Svéikinu atvỹkus į̃ Kasablánką ir̃ lìnkiu malõnios viešnãgės.	Sveikinu atvykus į Kasablanką ir linkiu malonios viešnagės.	To welcome you to casablanca and to wish you a pleasant stay.
Retaĩ kadà apsilañko, tokiẽ garbìngi svečiaĩ.	Retai kada apsilanko, tokie garbingi svečiai.	It isn't often we have so distinguished a visitor.
Manè pérspėjo, kàd jū̃s gražiáusia móteris atvỹkusi į̃ Kasablánką.	Mane perspėjo, kad jūs gražiausia moteris atvykusi į Kasablanką.	I was told you were the most beautiful woman to visit Casablanca.
Kapitonè, kàs tàs pianìstas... esù kažkur̃ jį̃ mãčiusi.	Kapitone, kas tas pianistas... esu kažkur jį mačiusi.	Captain, the boy who's playing the piano... Somewhere I've seen him.
Jìs atvỹko ìš Parỹžiaus sù Rikù.	Jis atvyko iš Paryžiaus su Riku.	He came from Paris with Rick.
Labaĩ malonù. Àš láukiau šiõ susitikìmo.	Labai malonu. Aš laukiau šio susitikimo.	This is a pleasure I've looked forward to.
Bū́tina aptartì visùs niuánsus dė̃l jū́sų bū̃vimo šiojè teritòrijoje.	Būtina aptarti visus niuansus dėl jūsų būvimo šioje teritorijoje.	I'd like to discuss some matters arising from your presence on French soil.
Manaũ, kàd nè laĩkas ir̃ nè vietà.	Manau, kad ne laikas ir ne vieta.	This is hardly the time or the place.
Mẽs jùk jaũ ẽsame bùvę, tokiosè situãcijose?	Mes juk jau esame buvę, tokiose situacijose?	We've been in difficult places before, haven't we?
Bèt mẽs, kuriẽ ẽsame láisvėje, padarýsime vìską, kàs įmãnoma.	Bet mes, kurie esame laisvėje, padarysime viską, kas įmanoma.	But we, who are still free, will do all we can. We are organized.
Jùk neseniaĩ turė́jome šíek tíek pramogų̃.	Juk neseniai turėjome šiek tiek pramogų.	We had quite a bit of excitement, right?
- Pagrók ką̃ nórs ìš senų̃ laikų̃. Sèmai.	- Pagrok ką nors iš senų laikų. Semai.	- Some of the old songs, Sam.
Táu reĩktų būtì geresniù melagiù, Sèmai.	Tau reiktų būti geresniu melagiu, Semai.	You used to be a much better liar, Sam.
Jū̃s klaũsėte apiẽ Rìką, Štaĩ ir̃ jìs.	Jūs klausėte apie Riką, Štai ir jis.	You were asking about Rick and here he is.
Kasablánkoje girdė́jau daũg gerų̃ atsiliepìmų apiẽ Rìką.	Kasablankoje girdėjau daug gerų atsiliepimų apie Riką.	One hears a great deal about Rick in Casablanca.
Õ apiẽ jùs kal̃ba visur̃ pasáulyje.	O apie jus kalba visur pasaulyje.	And about Victor Laszlo everywhere.
Taĩ bùvo dienà, kaĩ vókiečiai įsìveržė į̃ Parỹžių.	Tai buvo diena, kai vokiečiai įsiveržė į Paryžių.	That was the day the Germans marched into Paris.
Vókiečiai bùvo pil̃ki, õ jū̃s - mė́lyna.	Vokiečiai buvo pilki, o jūs - mėlyna.	The Germans wore gray, you wore blue.
Kaĩ vókiečiai pasitráukė, vė̃l ją̃ apsivilkaũ.	Kai vokiečiai pasitraukė, vėl ją apsivilkau.	When the Germans march out, I'll wear it again.
Rìkai, jū̃s tãpote panašùs į̃ žmógų.	Rikai, jūs tapote panašus į žmogų.	You're becoming quite human.
Ùž taĩ reĩktų padėkóti jùms, panelè.	Už tai reiktų padėkoti jums, panele.	I suppose we have to thank you for that.
Jìs šiõs dainõs negrójo jaũ ìlgą láiką.	Jis šios dainos negrojo jau ilgą laiką.	He hasn't played it in a Iong time.
Negalė́čiau atsakýti, nórs ir̃ dažnaĩ matýdavau jį̃ Parỹžiuje.	Negalėčiau atsakyti, nors ir dažnai matydavau jį Paryžiuje.	I really can't say, though I saw him quite often in Paris.
Bèt tìk víenas atsãkymas, gãli atsakýti į̃ visùs klaũsymus.	Bet tik vienas atsakymas, gali atsakyti į visus klausymus.	Only one answer can take care of all our questions.
Heñris dãvė dár trìs šampãno bùtelius.	Henris davė dar tris šampano butelius.	Henri wants us to finish three more bottles.
Okupãcijos metù gãlima įžvelgtì ir̃ pliùsų, ponè.	Okupacijos metu galima įžvelgti ir pliusų, pone.	This ought to take the sting out of being occupied.
Sãko, kàd Parỹžiuje tìkisi būtì jaũ rytój.	Sako, kad Paryžiuje tikisi būti jau rytoj.	They say they expect to be in Paris tomorrow.
Vìsas pasáulis griū̃va, õ mẽs pamìlome víenas kìtą.	Visas pasaulis griūva, o mes pamilome vienas kitą.	With the world crumbling, we pick this time to fall in love.
Vókiečiai jaũ greĩt bùs čià ir̃ íeškos jū́sų.	Vokiečiai jau greit bus čia ir ieškos jūsų.	Germans will be here pretty soon and they'Il come looking for you.
Ir̃ ùž jū́sų gálvą paskìrtas ãtlygis.	Ir už jūsų galvą paskirtas atlygis.	There's a price on your head.
Turiù kaĩ ką̃ padarýti miestè. Priẽš išvỹkstant.	Turiu kai ką padaryti mieste. Prieš išvykstant.	I have things to do in the city before I leave.
Pabučiúok, tar̃si taĩ bū́tų paskutìnis bučinỹs.	Pabučiuok, tarsi tai būtų paskutinis bučinys.	Kiss me as if it were the last time.
Paskutìnis traukinỹs išvỹksta ùž trijų̃ minùčių.	Paskutinis traukinys išvyksta už trijų minučių.	all aboard! The last train leaving in three minutes.
Juokìnga, bèt tàvo bal̃sas nepasìkeitė. Vìs dár girdžiù:	Juokinga, bet tavo balsas nepasikeitė. Vis dar girdžiu:	It's funny how your voice hasn't changed. I can still hear it.
Ìš tiẽsų, girdė́jau daugýbę tokių̃ istòrijų.	Iš tiesų, girdėjau daugybę tokių istorijų.	I've heard a Iot of stories in my time.
Jiẽ susitiñka grójant pianìnui apatìnio aũkšto kambaryjè.	Jie susitinka grojant pianinui apatinio aukšto kambaryje.	They went along with the sound of a tinny piano playing in the parlor downstairs.
Spė́ju, kàd neĩ vienà ìš šių̃ istòrijų nėrà liñksma.	Spėju, kad nei viena iš šių istorijų nėra linksma.	I guess neither one of our stories is very funny.
Àš manaũ, kàd jìs tìk dár kìtas amerikiẽtis juokdarỹs.	Aš manau, kad jis tik dar kitas amerikietis juokdarys.	My impression was that he's just another blundering American.
Õ màno pãreiga - užtìkrinti, kàd čià ir̃ lìktumėte.	O mano pareiga - užtikrinti, kad čia ir liktumėte.	It is my duty to see that you stay here.
Ką̃ gì, gál mán patìks Kasablánkoje.	Ką gi, gal man patiks Kasablankoje.	Well, perhaps I shall like it in Casablanca.
Arbà išvyktì į̃ Lisabòną jaũ rytój.	Arba išvykti į Lisaboną jau rytoj.	Or you may leave for Lisbon tomorrow.
Ir̃ pãgarbą, kàd padė́jote Trečiájam Reĩchui.	Ir pagarbą, kad padėjote Trečiajam Reichui.	And the honor of having served the Third Reich.
Dabar̃ mán áišku, kodė̃l garsė́jate ìškalba.	Dabar man aišku, kodėl garsėjate iškalba.	You have a reputation for eloquence, which I can now understand.
Sãkote, kàd Reĩcho príešininkai gãli būtì pakeistì kitaĩs.	Sakote, kad Reicho priešininkai gali būti pakeisti kitais.	You said enemies of the Reich could be replaced.
- Tíek, kíek léidžia màno pareigõs.	- Tiek, kiek leidžia mano pareigos.	- Insofar as it is in my power...
Akivaizdù, kàd dabar̃ jíems reĩks kreĩptis į̃ júodąją rìnką.	Akivaizdu, kad dabar jiems reiks kreiptis į juodąją rinką.	Their next step will be to the black market.
Nè, serè, mẽs negãlime išvengtì polìcijos.	Ne, sere, mes negalime išvengti policijos.	Sorry, we wouldn't be able to handle the police.
Pažintìs sù juõ gãli būtì naudìnga.	Pažintis su juo gali būti naudinga.	It can be most helpful to know Ferrari.
Kiekvíeną kar̃tą màno siuntinỹs bū̃na nepìlnas.	Kiekvieną kartą mano siuntinys būna nepilnas.	Every time you send my shipment, it's always a bit short.
Nóriu apiẽ kaĩ ką̃ pakalbė́ti. Burbòno, prašaũ.	Noriu apie kai ką pakalbėti. Burbono, prašau.	There's something I want to talk over with you.
Kaĩp ir̃ àš, nórs ir̃ nesù geràs ver̃slininkas.	Kaip ir aš, nors ir nesu geras verslininkas.	So could I, and I'm a poor businessman.
Rìkai, manaũ, kàd jū̃s žìnote, kur̃ jiẽ ỹra.	Rikai, manau, kad jūs žinote, kur jie yra.	I'll put my cards out. I think you know where they are.
Štaĩ kodė̃l atėjaũ čià, suteĩkdamas laĩko apieškóti màno kavìnę.	Štai kodėl atėjau čia, suteikdamas laiko apieškoti mano kavinę.	I came over here to give them a chance to ransack my place.
Tàvo pãsakojimas sùjaukė mán prõtą. Õ gál káltas burbònas?	Tavo pasakojimas sujaukė man protą. O gal kaltas burbonas?	Your story had me confused, or maybe it was the bourbon.
Rìkui, kurį̃ pažinójau Parỹžiuje, bū́čiau pasãkiusi.	Rikui, kurį pažinojau Paryžiuje, būčiau pasakiusi.	The Rick I knew in Paris, I could tell him.
Bèt vãkar tù žiūrė́jai sù tokià neapýkanta...	Bet vakar tu žiūrėjai su tokia neapykanta...	But the one who looked at me with such hatred...
Jìs bùvo ir̃ tadà, kaĩ susipažìnome Parỹžiuje.	Jis buvo ir tada, kai susipažinome Paryžiuje.	And was, even when I knew you in Paris.
Kaĩp lýderis juodõjoje rìnkoje, àš esù įtakìngas ir̃ ger̃biamas.	Kaip lyderis juodojoje rinkoje, aš esu įtakingas ir gerbiamas.	As leader of all illegal activities, I'm an influential and respected man.
Põnas Ferãri patìkino, kàd táu gãli parū́pinti išvykìmo vìzą.	Ponas Ferari patikino, kad tau gali parūpinti išvykimo vizą.	SeÃ±or Ferrari thinks it might just be possible to get an exit visa for you.
Įvỹktų stebùklas, jéi jùms pavỹktų ištrūktì.	Įvyktų stebuklas, jei jums pavyktų ištrūkti.	It'd take a miracle to get you out.
Mataũ, kàd jùms víenu ãtžvilgiu labaĩ pasìsekė.	Matau, kad jums vienu atžvilgiu labai pasisekė.	I observe that you, in one respect, are very fortunate.
Nežinaũ kodė̃l, nès taĩ neduõs mán pel̃no.	Nežinau kodėl, nes tai neduos man pelno.	Why, I do not know. It cannot possibly profit me.
Malonù, taĩ girdė́ti ìš jū́sų lū́pų.	Malonu, tai girdėti iš jūsų lūpų.	It was gracious of you to share it with me.
Ponè Rìkai, jū̃s tàpsite geriáusiu sàvo klientù.	Pone Rikai, jūs tapsite geriausiu savo klientu.	You are getting to be your best customer.
Jū́sų výrai àpvertė aukštỹn kójom šią̃ viẽtą.	Jūsų vyrai apvertė aukštyn kojom šią vietą.	That's some going-over your men gave my place.
Àš liepiaũ výrams būtì ýpač atidíems.	Aš liepiau vyrams būti ypač atidiems.	But I told my men to be especially destructive.
Suprañtama, kóks kláusimas - tóks atsãkymas.	Suprantama, koks klausimas - toks atsakymas.	Serves me right for asking a direct question.
Taĩgi, Ivòna pérėjo į̃ príešo pùsę.	Taigi, Ivona perėjo į priešo pusę.	So Yvonne's gone over to the enemy.
Gál jì įkū́rė ir̃ añtrąjį fròntą.	Gal ji įkūrė ir antrąjį frontą.	In her own way, she may constitute an entire second front.
Vìsą eĩlę pràdedant čià ir̃ baĩgiant šìčia.	Visą eilę pradedant čia ir baigiant šičia.	Put up the whole row of those. Starting here and ending here.
Ką̃ àš pasakiaũ ỹra nè jū́sų reĩkalas.	Ką aš pasakiau yra ne jūsų reikalas.	What I said is not your business.
Mẽs sténgiamės bendradarbiáuti sù jū́sų valdžià.	Mes stengiamės bendradarbiauti su jūsų valdžia.	We're trying to cooperate with your government.
Jū̃s tiksliaĩ žìnote, kurią̃ pùsę palaĩkote?	Jūs tiksliai žinote, kurią pusę palaikote?	Are you certain which side you're on?
Tikiúosi, kàd Reĩchas tokiõs galimýbės nesvar̃sto.	Tikiuosi, kad Reichas tokios galimybės nesvarsto.	Surely the Reich doesn't admit that possibility?
Mẽs susirū́pinę nè víen dė̃l Kasablánkos.	Mes susirūpinę ne vien dėl Kasablankos.	We're concerned about more than Casablanca.
Nórime nuvỹkę į̃ Amèriką jaũstis kaĩp namiẽ.	Norime nuvykę į Ameriką jaustis kaip namie.	So we should feel at home when we get to America.
Priẽ rulètės stãlo, bañdo laimė́ti pinigų̃ išvykìmo vìzoms.	Prie ruletės stalo, bando laimėti pinigų išvykimo vizoms.	At the roulette table, trying to win enough for our exit visas.
Jìs sãkė, kàd gãli gautì išvykìmo vizàs.	Jis sakė, kad gali gauti išvykimo vizas.	He tells me he can give us an exit visa.
Jéi tìk žinótumėte, ką̃ mùms réiškia keliõnė į̃ Amèriką.	Jei tik žinotumėte, ką mums reiškia kelionė į Ameriką.	But if you knew what it means to us to leave Europe, to get to America.
Turbū́t jìs prìminė jùms laimingesnès dienàs Parỹžiuje.	Turbūt jis priminė jums laimingesnes dienas Paryžiuje.	I suppose he means to you Paris of happier days.
Porà tū́kstančių mažiaũ, neĩ maniaũ, kàd bùs.	Pora tūkstančių mažiau, nei maniau, kad bus.	A couple of thousand less than I thought there would be.
Ponè Rìkai, gál atneštì puodẽlį kavõs?	Pone Rikai, gal atnešti puodelį kavos?	Monsieur Rick, may I get you a cup of coffee?
Ateĩkite rytój pàs manè į̃ kabinètą.	Ateikite rytoj pas mane į kabinetą.	Come to my office. We'll be businesslike.
Kodė̃l jū̃s įsikìšote į̃ màno reĩkalus?	Kodėl jūs įsikišote į mano reikalus?	Why interfere with my little romances?
Bèt rytój sù manimì bùs nuostabì blondìnė.	Bet rytoj su manimi bus nuostabi blondinė.	But I'lI be in tomorrow with a breathtaking blonde.
Kaĩp žìnote, mán svarbù išvyktì ìš Kasablánkos.	Kaip žinote, man svarbu išvykti iš Kasablankos.	You know it's very important I get out of casablanca.
Màno láisvė ir̃ galimýbė tęstì dárbą svarbì tū́kstančiams žmonių̃.	Mano laisvė ir galimybė tęsti darbą svarbi tūkstančiams žmonių.	You know what it means to the work, to the lives of thousands of people that I continue my work.
Àš girdė́jau apiẽ jū́sų praeitiẽ dárbus.	Aš girdėjau apie jūsų praeitie darbus.	My friends in the underground tell me that you've quite a record.
Rytè sãkėte, kàd jám pavojìnga išvyktì.	Ryte sakėte, kad jam pavojinga išvykti.	This morning it wasn't safe for him to leave.
Taĩ tiesà. Saugù gãli būtì tìk okupúotoje Prancūzìjoje.	Tai tiesa. Saugu gali būti tik okupuotoje Prancūzijoje.	That's also true, except to return to occupied France.
Prancūzìjos valdžià ràs príežastį uždarýti jį̃ į̃ koncentrãcijos stovỹklą.	Prancūzijos valdžia ras priežastį uždaryti jį į koncentracijos stovyklą.	French authorities may find a reason to put him in the concentration camp here.
Prašaũ, brangùsis, neĩk šią̃nakt į̃ tą̃ susirinkìmą.	Prašau, brangusis, neik šiąnakt į tą susirinkimą.	Please don't go to the underground meeting.
Výras retaĩ gãli paródyti didvyriškùmą priẽš sàvo žmóną.	Vyras retai gali parodyti didvyriškumą prieš savo žmoną.	It isn't often that a man gets to display heroics before his wife.
Tegul̃ mū́sų draũgas laukè màno, kàd nuė̃jome miegóti.	Tegul mūsų draugas lauke mano, kad nuėjome miegoti.	Our friend outside will think we've retired by now.
Kaĩ buvaũ koncentrãcijos stovỹkloje jauteĩsi víeniša?	Kai buvau koncentracijos stovykloje jauteisi vieniša?	When I was in the concentration camp were you lonely in Paris?
Ką̃ gì, visái neblogaĩ sẽkasi ver̃slas, ponè Rìkai.	Ką gi, visai neblogai sekasi verslas, pone Rikai.	Well, you are in pretty good shape, Herr Rick.
- Rìčardai, turė́jau sù tavimì susitìkti.	- Ričardai, turėjau su tavimi susitikti.	- Richard, I had to see you.
Tàvo apsilañkymo tìkslas... nesusíejęs sù taĩs dviẽm laiškaĩs?	Tavo apsilankymo tikslas... nesusiejęs su tais dviem laiškais?	Your visit isn't connected by any chance with the letters of transit?
Atródo, kõl àš juõs turė́siu, mán ramýbės nebùs.	Atrodo, kol aš juos turėsiu, man ramybės nebus.	As long as I have them, I'll never be lonely.
Sakýk bèt kókią káiną, tìk dúok tuõs láiškus.	Sakyk bet kokią kainą, tik duok tuos laiškus.	Ask any price, but give me those letters.
Nórs ir̃ skirtìngais bū̃dais, bèt síekėte tõ pãčio tìkslo.	Nors ir skirtingais būdais, bet siekėte to pačio tikslo.	In your way you were fighting for the same thing.
Àš ùž niẽką nebekovóju, išskýrus savè.	Aš už nieką nebekovoju, išskyrus save.	I'm not fighting for anything anymore, except myself.
Atléisk, bèt tù esì paskutìnė mū́sų viltìs.	Atleisk, bet tu esi paskutinė mūsų viltis.	I'm sorry, but you- You are our last hope.
Jéi mùms nepadė́si, Vìktoras mir̃s Kasablánkoje.	Jei mums nepadėsi, Viktoras mirs Kasablankoje.	If you don't help us, Victor will die in Casablanca.
Bèt tadà atė̃jo naujíena, kàd jìs mìrė.	Bet tada atėjo naujiena, kad jis mirė.	Then it came. He was dead.
Nèt artimiáusi draugaĩ apiẽ taĩ nežinójo.	Net artimiausi draugai apie tai nežinojo.	Not even our closest friends knew about it.
Atė̃jo draũgas ir̃ pasãkė, kàd Vìktoras gývas.	Atėjo draugas ir pasakė, kad Viktoras gyvas.	A friend came and told me that Victor was alive.
Nežinaũ, ar̃ turė́čiau jėgų̃ tavè paliktì dár kar̃tą.	Nežinau, ar turėčiau jėgų tave palikti dar kartą.	I know I'lI never have the strength to leave you again.
Tadà turė̃s sàvo mýlimą dárbą, dė̃l kuriõ gyvẽna.	Tada turės savo mylimą darbą, dėl kurio gyvena.	Then he'll have his work. all that he's been living for.
Nustósime kovóti sù príešais - pasáulis mir̃s.	Nustosime kovoti su priešais - pasaulis mirs.	We stop fighting our enemies, the world will die.
Į̃ žmógų, kurìs įtikinė́ja savè tuõ, kuõ nètiki širdimì.	Į žmogų, kuris įtikinėja save tuo, kuo netiki širdimi.	Like a man who's convincing himself of something he doesn't believe.
Jū̃s žìnote vìską apiẽ màno likìmą.	Jūs žinote viską apie mano likimą.	You seem to know all about my destiny.
Kadángi nė̃ víenas dė̃l tõ nekaltàs àš neprašaũ paáiškinimo.	Kadangi nė vienas dėl to nekaltas aš neprašau paaiškinimo.	Since no one is to blame I demand no explanation.
Suprantù, kàd jū̃s mán laiškų̃ nedúosite nà ir̃ geraĩ.	Suprantu, kad jūs man laiškų neduosite na ir gerai.	I ask only one thing. You won't give me the letters all right.
Bèt nóriu, kàd žmonà bū́tų saugì.	Bet noriu, kad žmona būtų saugi.	But I want my wife to be safe.
Nemanýkite, kàd àš tìk pasipríešinimo lýderis.	Nemanykite, kad aš tik pasipriešinimo lyderis.	apparently, you think of me only as the leader of a cause.
Atródo, kàd likìmas sučiùpo ùž rañkos.	Atrodo, kad likimas sučiupo už rankos.	It seems that destiny has taken a hand.
Taĩ nėrà Vokietijà ar̃ okupúota Prancūzijà.	Tai nėra Vokietija ar okupuota Prancūzija.	This isn't Germany or occupied France.
Rìkai, nesitikė́kite per̃ daũg ìš màno draugỹstės.	Rikai, nesitikėkite per daug iš mano draugystės.	Don't count too much on my friendship.
Àš ìš Kasablánkos ìšskrendu šiañdien, paskutiniù lėktuvù.	Aš iš Kasablankos išskrendu šiandien, paskutiniu lėktuvu.	I'm leaving CasabIanca on tonight's plane. The last plane.
Ir̃ pasìimu víeną draũgę sù savimì.	Ir pasiimu vieną draugę su savimi.	I'm taking a friend with me.
Jìs paskutìnis asmuõ, kurį̃ norė́čiau matýti Amèrikoje.	Jis paskutinis asmuo, kurį norėčiau matyti Amerikoje.	The last man I want to see in America.
Tereĩkia įrašýti vardùs ir̃ išvỹktumėte bèt kuriuõ metù.	Tereikia įrašyti vardus ir išvyktumėte bet kuriuo metu.	Fill in your name and hers and leave anytime you please.
Bèt daũgelis čià laĩkomi priẽš jų̃ vãlią.	Bet daugelis čia laikomi prieš jų valią.	We have a legal right to go, but people have been held here in spite of their legal rights.
Õ jùms garántuos papìldomų unifòrmos juostẽlių.	O jums garantuos papildomų uniformos juostelių.	That'd be a feather in your cap.
Atvỹkit pàs manè lìkus pùsvalandžiui ikì lėktùvo skrỹdžio.	Atvykit pas mane likus pusvalandžiui iki lėktuvo skrydžio.	Be at my place a half-hour before the plane leaves.
Ir̃ bùs puikì próga jį̃ suimtì.	Ir bus puiki proga jį suimti.	That'Il give you the grounds to make the arrest.
Vókiečiams, taĩ sukel̃s tìk nedìdelius nepatogumùs.	Vokiečiams, tai sukels tik nedidelius nepatogumus.	To the Germans, that last will be just a minor annoyance.
Õ kaĩp žinósiu, kàd laikýsitės žõdžio?	O kaip žinosiu, kad laikysitės žodžio?	How do I know you'Il keep your bargain?
Ir̃ atšaũkit sàvo sarginiùs šunìs, kaĩ jį̃ paléisite.	Ir atšaukit savo sarginius šunis, kai jį paleisite.	Call off your watchdogs when you let him go.
Lùisai, nenóriu rizikúoti. Nètgi sù jumìs.	Luisai, nenoriu rizikuoti. Netgi su jumis.	I'm taking no chances, not even with you.
Ar̃ pasirašýsime ką̃ nórs, ar̃ užtèks ir̃ rañkos paspaudìmo?	Ar pasirašysime ką nors, ar užteks ir rankos paspaudimo?	ferrari: Should we draw it up, or is a handshake good enough?
Žìnoma, bè jų̃ taĩ nè Rìko kavìnė.	Žinoma, be jų tai ne Riko kavinė.	Of course. Rick's wouldn't be Rick's without them.
Nepamir̃škite, jū̃s tùrite šim̃tą dėžių̃ amerikiẽtiškų cigarèčių.	Nepamirškite, jūs turite šimtą dėžių amerikietiškų cigarečių.	Remember you owe Rick's 100 carton of cigarettes.
- Buvaũ informúotas, kadà jìs palìko viẽšbutį.	- Buvau informuotas, kada jis paliko viešbutį.	- I was informed as he left the hotel.
Vìktoras galvója, kàd skrìsiu sù juõ.	Viktoras galvoja, kad skrisiu su juo.	Victor thinks I'm going with him.
Kuõ mažiaũ laĩko mąstýti, tuõ lengviaũ.	Kuo mažiau laiko mąstyti, tuo lengviau.	The less time to think, the easier.
Jū̃s káltinamas bendradarbiãvimu kùrjerių žmogžudỹstėje, síekiant pavogtì tranzìto láiškus.	Jūs kaltinamas bendradarbiavimu kurjerių žmogžudystėje, siekiant pavogti tranzito laiškus.	For accessory to the murder of the couriers from whom these were stolen.
Dvíem keleĩviams sù tranzìtiniais laiškaĩs léidžiama skristì Į̃ Lisabòną.	Dviem keleiviams su tranzitiniais laiškais leidžiama skristi Į Lisaboną.	There'll be two letters of transit for Lisbon. There's to be no trouble about them.
Praė̃jusį vãkarą pasãkėme daũg gražių̃ žõdžių.	Praėjusį vakarą pasakėme daug gražių žodžių.	Last night we said a great many things.
Bèt vìską sùvedžiau į̃ víeną atsãkymą:	Bet viską suvedžiau į vieną atsakymą:	I've done a lot. It all adds up to one thing:
- Tù taĩp sãkei, nès nóri, kàd skrìsčiau.	- Tu taip sakei, nes nori, kad skrisčiau.	- You're saying this to make me go.
Mẽs abù žìnome, kàd tàvo vietà šalià Vìktoro.	Mes abu žinome, kad tavo vieta šalia Viktoro.	Inside we both know you belong with Victor.
Ikì tàvo atvykìmo į̃ Kasablánką mẽs jį̃ bùvome prarãdę.	Iki tavo atvykimo į Kasablanką mes jį buvome praradę.	We didn't have. We'd lost it until you came to casablanca.
Ir̃ tù negãli būtì vìso tõ dalimì.	Ir tu negali būti viso to dalimi.	What I do, you can't be any part of.
Rìkai, jū̃s nè tìk sentimentalùs, bèt tãpote tikrù patriotù.	Rikai, jūs ne tik sentimentalus, bet tapote tikru patriotu.	You're not only a sentimentalist, but you've become a patriot.
Visái neblogaĩ bū́tų jùms išnyktì ìš Kasablánkos kuriám laĩkui.	Visai neblogai būtų jums išnykti iš Kasablankos kuriam laikui.	It might be good for you to disappear from casablanca for a while.
Lùisai manaũ, kàd taĩ grãžios draugỹstės pradžià.	Luisai manau, kad tai gražios draugystės pradžia.	Louis I think this is the beginning of a beautiful friendship.
Geriaũ sugrį̃žkime, kaĩ nuim̃s grūdų̃ der̃lių.	Geriau sugrįžkime, kai nuims grūdų derlių.	Let's come back after the barley has ripened
Ar̃ jaũ nėrà dievų̃, kuriẽ mùs apsáugotų?	Ar jau nėra dievų, kurie mus apsaugotų?	Is there no god to protect us?
Dievaĩ turbū́t nóri, kàd mir̃tume ìš bãdo!	Dievai turbūt nori, kad mirtume iš bado!	God must want us farmers to starve!
